I'd never been in play long enough for the flowers to die in the dressing room.,Mercedes McCambridge,funny
I'm the only man in the world with a marriage licence made out to whom it may concern.,Mickey Rooney,funny
"Someone told me that when they go to Vermont, they feel like they're home. I'm that way at Saks.",Caroline Rhea,funny
Trust is hard to come by. That's why my circle is small and tight. I'm kind of funny about making new friends.,Eminem,funny
"I was asked to act when I couldn't act. I was asked to sing 'Funny Face' when I couldn't sing, and dance with Fred Astaire when I couldn't dance - and do all kinds of things I wasn't prepared for. Then I tried like mad to cope with it.",Audrey Hepburn,funny
There is hope for the future because God has a sense of humor and we are funny to God.,Bill Cosby,funny
Life does not cease to be funny when people die any more than it ceases to be serious when people laugh.,George Bernard Shaw,funny
"From there to here, and here to there, funny things are everywhere.",Dr. Seuss,funny
"It's a funny thing that when a man hasn't anything on earth to worry about, he goes off and gets married.",Robert Frost,funny
"You know, fame is a funny thing, man, especially, you know, actors, musicians, rappers, rock singers, it's kind of a lifestyle and it's easy to get caught up in it - you go to bars, you go to clubs, everyone's doing a certain thing... It's tough.",Eminem,funny
"Design is a funny word. Some people think design means how it looks. But of course, if you dig deeper, it's really how it works.",Steve Jobs,funny
Forgiveness is a funny thing. It warms the heart and cools the sting.,William Arthur Ward,funny
"It's funny how most people love the dead, once you're dead your made for life.",Jimi Hendrix,funny
"It's a funny thing about life if you refuse to accept anything but the best, you very often get it.",W. Somerset Maugham,funny
But you can't focus on things that matter if all you've been is asleep for forty years. Funny how sleep rhymes with sheep. You know.,Charlie Sheen,funny
I saw 28 Days. I don't remember rehab being like a day camp or being that funny. Rehab is a dumping ground. It's a big landfill.,Charlie Sheen,funny
"It's funny the way most people love the dead. Once you are dead, you are made for life.",Jimi Hendrix,funny
"The most exciting phrase to hear in science, the one that heralds new discoveries, is not 'Eureka!' but 'That's funny...'",Isaac Asimov,funny
"Everything is funny, as long as it's happening to somebody else.",Will Rogers,funny
It's hard to be funny when you have to be clean.,Mae West,funny
I'm not funny. What I am is brave.,Lucille Ball,funny
"If I studied all my life, I couldn't think up half the number of funny things passed in one session of congress.",Will Rogers,funny
A man's got to take a lot of punishment to write a really funny book.,Ernest Hemingway,funny
"Why is Cloud 9 so amazing? What is wrong with Cloud 8? That joke came off the top of my head, and the top of my head ain't funny!",Mitch Hedberg,funny
Life would be tragic if it weren't funny.,Stephen Hawking,funny
All these jokes have been pre-approved as funny by me.,Mitch Hedberg,funny
"Most comedy is based on getting a laugh at somebody else's expense. And I find that that's just a form of bullying in a major way. So I want to be an example that you can be funny and be kind, and make people laugh without hurting somebody else's feelings.",Ellen DeGeneres,funny
I don't mean to be funny.,Yogi Berra,funny
"Like almost everyone who uses e-mail, I receive a ton of spam every day. Much of it offers to help me get out of debt or get rich quick. It would be funny if it weren't so exciting.",Bill Gates,funny
It's a funny old world.,Margaret Thatcher,funny
I'm odd looking. Sometimes I think I look like a funny muppet.,Angelina Jolie,funny
"It is funny that men who are supposed to be scientific cannot get themselves to realise the basic principle of physics, that action and reaction are equal and opposite, that when you persecute people you always rouse them to be strong and stronger.",Gertrude Stein,funny
I am odd-looking. I sometimes think I look like a funny Muppet.,Angelina Jolie,funny
Comedy is simply a funny way of being serious.,Peter Ustinov,funny
"God writes a lot of comedy... the trouble is, he's stuck with so many bad actors who don't know how to play funny.",Garrison Keillor,funny
"Screaming at children over their grades, especially to the point of the child's tears, is child abuse, pure and simple. It's not funny and it's not good parenting. It is a crushing, scarring, disastrous experience for the child. It isn't the least bit funny.",Ben Stein,funny
"Whatever is funny is subversive, every joke is ultimately a custard pie... a dirty joke is a sort of mental rebellion.",George Orwell,funny
I think being funny is not anyone's first choice.,Woody Allen,funny
It's funny how you never think about the women you've had. It's always the ones who get away that you can't forget.,Chuck Palahniuk,funny
It is not funny that anything else should fall down only that a man should fall down. Why do we laugh? Because it is a gravely religious matter: it is the Fall of Man. Only man can be absurd: for only man can be dignified.,Gilbert K. Chesterton,funny
"To succeed in life, you need three things: a wishbone, a backbone and a funny bone.",Reba McEntire,funny
It's always funny until someone gets hurt. Then it's just hilarious.,Bill Hicks,funny
"You know the funny thing, I don't get along with rich people. I get along with the middle class and the poor people better than I get along with the rich people.",Donald Trump,funny
The best ideas come as jokes. Make your thinking as funny as possible.,David Ogilvy,funny
"I guess when you turn off the main road, you have to be prepared to see some funny houses.",Stephen King,funny
I got a lot of support from my parents. That's the one thing I always appreciated. They didn't tell me I was being stupid they told me I was being funny.,Jim Carrey,funny
There's nothing cure or funny or lovable about being cheap. It's a total turn-off.,Doug Coupland,funny
"I'm blonde and tanned and normal-sized! I'm sweet, shy, funny, have a big heart and I'm nice - and I like to eat.",Paris Hilton,funny
"I used to think that everything was just being funny but now I don't know. I mean, how can you tell?",Andy Warhol,funny
"As I get older, all sorts of things become less funny. Once one has children, any cruelty involving children becomes far less amusing than when one was at the mercy of one's friends' and relatives' children.",P. J. O'Rourke,funny
"There is nothing funny about Halloween. This sarcastic festival reflects, rather, an infernal demand for revenge by children on the adult world.",Jean Baudrillard,funny
"I had everything I'd hoped for, but I wasn't being myself. So I decided to be honest about who I was. It was strange: The people who loved me for being funny suddenly didn't like me for being... me.",Ellen DeGeneres,funny
It's funny about men and women. Men pay in cash to get them and pay in cash to get rid of them. Women pay emotionally coming and going. Neither has it easy.,Hedy Lamarr,funny
"A funny thing happens in real estate. When it comes back, it comes back up like gangbusters.",Barbara Corcoran,funny
"I know some people say I can be funny. But there is always a deeper meaning to what I say. I am a socialist at heart and have the interests of the poor in mind. When people see how I manage to work my way out of tough situations, it gives them hope in their own life.",Lalu Prasad Yadav,funny
My grandchildren are fabulous and funny.,Erica Jong,funny
"Certainly there are things in life that money can't buy, but it's very funny - Did you ever try buying then without money?",Ogden Nash,funny
"I could party in a cardboard box with people who are funny and don't care. For me, it's really about who I surround myself with, so I just try to always be with hilarious people.",Kesha,funny
"Chaos in the midst of chaos isn't funny, but chaos in the midst of order is.",Steve Martin,funny
"It's a funny thing, the less people have to live for, the less nerve they have to risk losing nothing.",Zora Neale Hurston,funny
"One of the funny things about the stock market is that every time one person buys, another sells, and both think they are astute.",William Feather,funny
"I don't care what the haters and naysayers say. If they make jokes about me, I'll laugh because they'll probably be funny.",Paula Deen,funny
"No matter how popular you are as a stand-up - you can go out and fill a 10,000-seat arena and be smart and funny - it's delicate to host an awards show and know where your place is and know that it's not about you, that it's about the people who are nominated, and respect that, but at the same time have your moment to show them who you are.",Ellen DeGeneres,funny
"I've always believed that there are funny people everywhere, but they're just not comedians. In fact, some of my best comedic inspirations were not professional entertainers.",Steve Martin,funny
"I thought 'Borat' was a breakthrough comedy, because it was really funny. It wasn't some studio-produced script with 14 writers.",Steve Martin,funny
"'Dirty Rotten Scoundrels' is a good one because it not only turned out, I think, to be a really funny movie but it was also a delight to shoot. We were in the South of France, working with Glenne Headly and Michael Caine and Frank Oz the director - who were just fun.",Steve Martin,funny
You need to be silly to be funny.,William Shatner,funny
"You know how old I am? I'm so old, I remember when Letterman used to be funny and it was presidents who were serious. That's how old I am.",Rush Limbaugh,funny
"In my circle of friends, I've always been loud and funny and talkative. But as soon as I step out of that circle, I get very quiet and introspective. I don't want the spotlight on me.",Rosie Perez,funny
"I remember straightening my hair because I wanted to be like everybody else, and now the fact that anybody would emulate what I do? It's just funny.",Taylor Swift,funny
"Sixth grade was a big time, in my childhood, of hoops and friendship, and coming up with funny things.",Adam Sandler,funny
"I got attention by being funny at school, pretending to be retarded, and jumping around with a deformed hand.",Leonardo DiCaprio,funny
I think it's funny to be delicate with subjects that are explosive.,Jerry Seinfeld,funny
Life can be dramatic and funny all in the same day.,Jennifer Aniston,funny
"The middle class is so funny, it's the class I know best, and it's the class where you find the most pretension, so that's what makes the middle classes so funny.",J. K. Rowling,funny
I'm smart and I can be really funny and interesting and I can go toe-to-toe with anybody in a conversation.,Megan Fox,funny
"It's to paint directly on the canvas without any funny business, as it were, and I use almost pure turpentine to start with, adding oil as I go along until the medium becomes pure oil. I use as little oil as I can possibly help, and that's my method.",Edward Hopper,funny
I had an idea of what I thought was funny. It's kind of based on how I am.,Jennifer Aniston,funny
"You know being relevant or coming up with something interesting, funny to say about what's current is just as hard as it might ever be depending on the serendipity of it all.",Lily Tomlin,funny
"It is funny the two things most men are proudest of is the thing that any man can do and doing does in the same way, that is being drunk and being the father of their son.",Gertrude Stein,funny
"That's what I hate about a lot of comedies, when you're hitting a line or making it funny.",Jennifer Aniston,funny
I read a lot of scripts that I just don't find very funny.,Jennifer Aniston,funny
"My hair has never been my greatest feature, so that was funny enough unto itself that my hair became so focused on.",Jennifer Aniston,funny
"Comediennes are the lucky ones, because if you're funny, you can be 125 years old and they will still accept you.",Joan Rivers,funny
"Being funny is one of my greatest strengths. I can make girls smile when they're down, and when they're having a good time, I can carry on the joke.",John Krasinski,funny
"Do you know, it's funny, but I never thought of being blind as a disadvantage, and I never thought of being black as a disadvantage.",Stevie Wonder,funny
If you play it straight it's funny - the best comedy is always played straight down the middle. The adjustment is understanding from the screenplay that a moment is hilarious.,Tom Hiddleston,funny
"Keep your sense of humor, my friend if you don't have a sense of humor it just isn't funny anymore.",Wavy Gravy,funny
Funny is only something that others know about you - you can't be funny by yourself.,Chris Rock,funny
Cheryl Cole and Katy Perry are two of the hottest girls in the world - and so normal and funny with it. If I was a few years older they are the kind of girls I'd like to date. I want a younger version of Cheryl and Katy - a mixture of the two would be hot.,Justin Bieber,funny
"Jon Stewart is exactly the same guy he's always been, only with money. He knows that the moment he really believes he's important, the funny goes away and he becomes Bill O'Reilly, except shorter and Jewish.",Denis Leary,funny
"Stand up is really fun because if I think of a joke or a funny idea, then I can just go and tell some people and if they laugh, they laugh right away.",Demetri Martin,funny
I think a lot of stuff I find funny is from day dreaming.,Demetri Martin,funny
I think since I was kid people told me that they thought I was funny.,Demetri Martin,funny
"The comedians I liked were Bill Cosby and Steven Wright, like just always as a comedic actor. I always liked Gary Larson, who's really funny for a cartoonist, obviously.",Demetri Martin,funny
It's hard to lead a cavalry charge if you think you look funny on a horse.,Adlai E. Stevenson,funny
"I wear black skinny-fit jeans - I can't get away from them. It's funny because I wore baggy jeans for ages, then one day my friend convinced me to try on a skinny pair and I thought they were great.",Shaun White,funny
"I never smoked. I never drank and I never took drugs. The funny thing is, nothing is more boring, people like this. For me, it's OK. But most of my friends, at least they smoke and drink.",Karl Lagerfeld,funny
One time I went into a restroom and a girl followed me in. I signed an autograph for her in the sink. It was pretty funny because she was in a guy's restroom and she wasn't embarrassed at all.,Zac Efron,funny
"The follow your dreams thing is really important because so many people are railroaded into taking other paths by their family, their friends, people who should be supportive going, 'What are you talking about?' Even just seemingly regular career paths, but if it's not what people expect for you they kind of react funny.",Joan Jett,funny
"A good artist is willing to die many times over. What's funny is, I've died so many times.",Billy Corgan,funny
Hollywood's just not funny.,Chris Rock,funny
"Karaoke isn't fair when you're a comedian. The whole idea is to get people laughing and enjoying themselves, and I'm a professional funny guy.",Chris Rock,funny
"It's funny. You succeed, but now where are you gonna go from there? I've got to keep proving that I can laugh or cry more real each time.",Jeff Bridges,funny
"Do I have a long-term plan? Kind of. I have a general direction, I think. But it's funny what comes down the pike.",Jeff Bridges,funny
"The people I grew up around who I really liked were quick on the draw. It always just wowed me. And my mum would make weird funny comments. I can see in myself her self-deprecating, hippie humour. I can't take myself too seriously.",Drew Barrymore,funny
"If you tell the truth about how you're feeling, it becomes funny.",Larry David,funny
I know what Germans are. They are a funny people. They are always choosing someone to lead them in a direction which they do not want to go.,Gertrude Stein,funny
"I was so afraid to even read a paper in front of my classmates. It is very funny because at that point my teachers would never have believed that I could speak in front of an audience of over 2,000 people.",Petra Nemcova,funny
"It's funny when people say, 'I don't think Julia likes me.' Honey, if I don't like you, you're going to know about it.",Julia Roberts,funny
It's funny how social activists usually protest against the only things that have a credible chance of achieving the activists' goals.,Craig Bruce,funny
"If you're going to tell people the truth, be funny or they'll kill you.",Billy Wilder,funny
"I think we're all good and bad, but good's not funny. Bad is funny. Suppress the good and let the bad out, and then you can be funny.",Larry David,funny
It's funny what a few no-hitters do for a body.,Satchel Paige,funny
"As soon as you are trying to be funny or dramatic, that's when things start feeling fake and boring.",Joseph Gordon-Levitt,funny
"What's funny is that the idea of popularity - even the use of the word 'popular' - is something that had been mostly absent from my life since junior high. In fact, the hallmark of life after junior high seemed to be the shedding of popularity as a central concern.",Susan Orlean,funny
"I mean I've seen 3D films so far and I think it's a long way to go before they replace actors. It's a funny thing with 3D, I haven't quite got it yet. Yet.",Daniel Radcliffe,funny
Funny things happen to you in movies for silly reasons.,Michael Caine,funny
"Chris Hemsworth is like Christopher Reeve in that he can do two things: he can wear a big red cape without a shred of self-consciousness. But he's also funny as hell, and he's so sweet. So with all the fish-out-of-water stuff, he's so funny. So he does almost two jobs in a way.",Tom Hiddleston,funny
"I like funny guys and those, for some reason, tend to be nerdy guys.",Megan Fox,funny
"The nightmare is you spend the rest of your life being funny at parties and then people say, 'Why didn't you do that when you were on television?'",Conan O'Brien,funny
"The funny thing about me that most people never really understand is that, at heart, I'm really a jock.",Billy Corgan,funny
"I was a hop-around. I hung out with the rockabilly crew, the guys who were trying to be rappers, the funny kids.",Katy Perry,funny
I wanted to be that quirky girl who writes funny songs that still have meaning.,Katy Perry,funny
Everything I buy is vintage and smells funny. Maybe that's why I don't have a boyfriend.,Lucy Liu,funny
"I'm a pretty funny guy, and I would love to do a comedy with a bunch of funny guys - movie-star guys, where they could help me through it.",LeBron James,funny
You can't really be strong until you see a funny side to things.,Ken Kesey,funny
"It's only I have seen enough of it and the funny thing is now, I know that I'm skinny, because I know there are even smaller clothes in the store. I think I'm big, when I was big, I never thought about it.",Karl Lagerfeld,funny
"I like reading Ball Tongue lyrics and all that stuff. And they published a book, and I wouldn't give my lyrics, and it's all wrong in the book, and I giggle. It's funny.",Jonathan Davis,funny
"They say Yogi Berra is funny. Well, he has a lovely wife and family, a beautiful home, money in the bank, and he plays golf with millionaires. What's funny about that?",Casey Stengel,funny
I don't think I'm funny.,Liam Neeson,funny
"It's funny, but you get to a time in your life when you think you have all the friends you will ever have.",Liam Neeson,funny
Books are funny little portable pieces of thought.,Susan Sontag,funny
It's funny. All you have to do is say something nobody understands and they'll do practically anything you want them to.,J. D. Salinger,funny
You have to discover when you're inadequate to be funny and you don't know you're inadequate when you're a kid.,Larry David,funny
"I gave a funny speech at my wife's birthday party, and I'm thinking, 'Hey, I've still got it.'",Larry David,funny
There's also a certain rhythm to the way Jews talk that might be funny.,Larry David,funny
"The funniest racism is the racism between minorities. It's something you don't see dramatized, but almost every minority I know who's my age, they have these funny stories about their parents stereotyping other minorities.",Mindy Kaling,funny
"Very often, I don't make it through moments of recording because it is genuinely funny and absolutely ridiculous that a 60-year-old grown man is making these noises.",David Ogden Stiers,funny
"I had the classic 40 meltdown. I did. It's embarrassing. It was pretty funny. But then I recovered. To me, it was like a second adolescence. Hormonally, my body was changing, my mind was changing, and so my relationship to myself and the world around me came to this assault of finiteness.",Keanu Reeves,funny
Life was a funny thing that happened to me on the way to the grave.,Quentin Crisp,funny
"Don't remember me as too nice or beautiful or funny, because then you'll be disappointed.",Celia Johnson,funny
"I don't like comedy. I like funny things. I don't like comedy. Like, comedy movies are just, 'Oh Jesus.'",Louis C. K.,funny
The funny thing is I'm not bothered or sad about being on my own - after all I've never had a husband.,Francesca Annis,funny
Light and funny has a more compelling quality when you're younger. But I haven't abandoned the genre: I love falling down I love Lucille Ball. It's just that a lot of those stories revolve around problems that I can't convincingly portray at this age.,Julia Roberts,funny
"I actually think of being funny as an odd turn of mind, like a mild disability, some weird way of looking at the world that you can't get rid of.",Calvin Trillin,funny
"When I was a little kid, I wrote this play about all these characters living in a haunted house. There was a witch who lived there, and a mummy. When they were all hassling him, this guy who bought the house - I can't believe I remember this - he said to them, 'Who's paying the mortgage on this haunted house?' I thought that was really funny.",Mindy Kaling,funny
Sometimes I think what I write is funny in its quiet way.,Doris Lessing,funny
Actually I never did stand up. I'm not that funny.,Maynard James Keenan,funny
"The funny thing is, the girls that I'm always up against for roles are pretty nice and cool, like Emma Watson. She's awesome.",Amanda Seyfried,funny
"I love readings and my readers, but the din of voices of the audience gives me stage fright, and the din of voices inside whisper that I am a fraud, and that the jig is up. Surely someone will rise up from the audience and say out loud that not only am I not funny and helpful, but I'm annoying, and a phony.",Anne Lamott,funny
"I've thought for the last decade or so, the only actual place raw truth was seeping through in newspapers was on the Comics Pages. They were able to pull off intelligent social comment, pure truths not found elsewhere in the news pages, and had the ability to make it all funny, entertaining, and pertinent.",Elayne Boosler,funny
I have only been funny about seventy four per cent of the time. Yes I think that is right. Seventy-four per cent of the time.,Will Ferrell,funny
"No, no, I was only funny on stage, really. I, I, think I was funny as a person toward my classmates when I was very young. You know, when I was a child, up to about the age of 12.",Rowan Atkinson,funny
"Hemingway seems to be in a funny position. People nowadays can't identify with him closely as a member of their own generation, and he isn't yet historical.",Leslie Fiedler,funny
"I think the pattern of my essays is, A funny thing happened to me on my way through Finnegans Wake.",Leslie Fiedler,funny
It's funny to be a critic.,Leslie Fiedler,funny
I find it so funny that people find me so interesting.,Britney Spears,funny
"Great, big, serious novels always get awards. If it's a battle between a great, big, serious novel and a funny novel, the funny novel is doomed.",Neil Gaiman,funny
"We've seen some insane signs: 'Is that a loaf of bread in your pocket, or are you just happy to see me?' Funny stuff along those lines. Very original. One just said, 'I will do unspeakable things.' I thought that was very interesting - and mildly terrifying!",Josh Hutcherson,funny
You know what's funny? I don't ever feel the need to escape. I have a strong marriage. I like my life. You hear about these guys having midlife crises - I don't see that happening to me.,"Harry Connick, Jr.",funny
"I don't really get shaken very much. People could heckle me, a spotlight could go out, I could forget a lyric... I'm not operating on somebody's brain, you know what I mean? So I just think it's all funny.","Harry Connick, Jr.",funny
"Without hurting anybody, we all tend to laugh at others' discomfort. When someone slips on a banana skin and falls it's funny.",Shahrukh Khan,funny
"Always remember your kid's name. Always remember where you put your kid. Don't let your kid drive until their feet can reach the pedals. Use the right size diapers... for yourself. And, when in doubt, make funny faces.",Amy Poehler,funny
I had to act in a school play when I was about ten years old. I really didn't want to do it. But everyone had to do it so I didn't have a choice. A talent agent came and watched it and later gave me some work. It's funny because I'd always known that I wanted a movie career. I just didn't think that I would be in the movies.,Kristen Stewart,funny
"I'm like, bursting. I should be working. I don't want to take a break. It's funny, on set, I don't have to go to the bathroom, I don't have anything wrong, I'm perfectly fine, so through-and-through. I'm not hungry. I'm literally not even in my own body.",Kristen Stewart,funny
