The problems of the world cannot possibly be solved by skeptics or cynics whose horizons are limited by the obvious realities. We need men who can dream of things that never were.,John F. Kennedy,men
But men are men the best sometimes forget.,William Shakespeare,men
Trust men and they will be true to you treat them greatly and they will show themselves great.,Ralph Waldo Emerson,men
"If we are marked to die, we are enough to do our country loss and if to live, the fewer men, the greater share of honor.",William Shakespeare,men
"Faith, there hath been many great men that have flattered the people who ne'er loved them.",William Shakespeare,men
Women are never disarmed by compliments. Men always are. That is the difference between the sexes.,Oscar Wilde,men
"If to do were as easy as to know what were good to do, chapels had been churches, and poor men's cottage princes' palaces.",William Shakespeare,men
What we call Man's power over Nature turns out to be a power exercised by some men over other men with Nature as its instrument.,C. S. Lewis,men
"Too often the great decisions are originated and given form in bodies made up wholly of men, or so completely dominated by them that whatever of special value women have to offer is shunted aside without expression.",Eleanor Roosevelt,men
Women have always been the strong ones of the world. The men are always seeking from women a little pillow to put their heads down on. They are always longing for the mother who held them as infants.,Coco Chanel,men
Content makes poor men rich discontent makes rich men poor.,Benjamin Franklin,men
Men's vows are women's traitors!,William Shakespeare,men
Dream no small dreams for they have no power to move the hearts of men.,Johann Wolfgang von Goethe,men
There have been many great men that have flattered the people who ne'er loved them.,William Shakespeare,men
Long before history began we men have got together apart from the women and done things. We had time.,C. S. Lewis,men
"The only power any government has is the power to crack down on criminals. Well, when there aren't enough criminals, one makes them. One declares so many things to be a crime that it becomes impossible for men to live without breaking laws.",Ayn Rand,men
Violent men have not been known in history to die to a man. They die up to a point.,Mahatma Gandhi,men
Men shut their doors against a setting sun.,William Shakespeare,men
"Measures must always in a progressive society be held superior to men, who are after all imperfect instruments, working for their fulfilment.",Mahatma Gandhi,men
"Men go abroad to wonder at the heights of mountains, at the huge waves of the sea, at the long courses of the rivers, at the vast compass of the ocean, at the circular motions of the stars, and they pass by themselves without wondering.",Saint Augustine,men
"Lord, Lord, how subject we old men are to this vice of lying!",William Shakespeare,men
Boxing is a lot of white men watching two black men beat each other up.,Muhammad Ali,men
Clever and attractive women do not want to vote they are willing to let men govern as long as they govern men.,George Bernard Shaw,men
Great men are they who see that spiritual is stronger than any material force - that thoughts rule the world.,Ralph Waldo Emerson,men
"As long as you know men are like children, you know everything!",Coco Chanel,men
I will not be concerned at other men's not knowing meI will be concerned at my own want of ability.,Confucius,men
There is always inequality in life. Some men are killed in a war and some men are wounded and some men never leave the country. Life is unfair.,John F. Kennedy,men
"All free men, wherever they may live, are citizens of Berlin. And therefore, as a free man, I take pride in the words 'Ich bin ein Berliner!'",John F. Kennedy,men
"We believe that if men have the talent to invent new machines that put men out of work, they have the talent to put those men back to work.",John F. Kennedy,men
The most pitiful among men is he who turns his dreams into silver and gold.,Khalil Gibran,men
"A man is a god in ruins. When men are innocent, life shall be longer, and shall pass into the immortal, as gently as we awake from dreams.",Ralph Waldo Emerson,men
All men by nature desire knowledge.,Aristotle,men
"Heights by great men reached and kept were not obtained by sudden flight but, while their companions slept, they were toiling upward in the night.",Henry Wadsworth Longfellow,men
"The TV business is uglier than most things. It is normally perceived as some kind of cruel and shallow money trench through the heart of the journalism industry, a long plastic hallway where thieves and pimps run free and good men die like dogs, for no good reason.",Hunter S. Thompson,men
"When men and woman die, as poets sung, his heart's the last part moves, her last, the tongue.",Benjamin Franklin,men
"Observe all men, thyself most.",Benjamin Franklin,men
"Democracy arises out of the notion that those who are equal in any respect are equal in all respects because men are equally free, they claim to be absolutely equal.",Aristotle,men
"In the affairs of this world, men are saved not by faith, but by the want of it.",Benjamin Franklin,men
Nothing astonishes men so much as common sense and plain dealing.,Ralph Waldo Emerson,men
Bad men are full of repentance.,Aristotle,men
Nine men in ten are would be suicides.,Benjamin Franklin,men
"All men are by nature equal, made all of the same earth by one Workman and however we deceive ourselves, as dear unto God is the poor peasant as the mighty prince.",Plato,men
"Men's actions are too strong for them. Show me a man who has acted, and who has not been the victim and slave of his action.",Ralph Waldo Emerson,men
"Men love to wonder, and that is the seed of science.",Ralph Waldo Emerson,men
"There is a blessed necessity by which the interest of men is always driving them to the right and, again, making all crime mean and ugly.",Ralph Waldo Emerson,men
"If you want to sacrifice the admiration of many men for the criticism of one, go ahead, get married.",Katharine Hepburn,men
Every actual State is corrupt. Good men must not obey laws too well.,Ralph Waldo Emerson,men
"I began revolution with 82 men. If I had to do it again, I do it with 10 or 15 and absolute faith. It does not matter how small you are if you have faith and plan of action.",Fidel Castro,men
Truth is the property of no individual but is the treasure of all men.,Ralph Waldo Emerson,men
It was pride that changed angels into devils it is humility that makes men as angels.,Saint Augustine,men
Men admire the man who can organize their wishes and thoughts in stone and wood and steel and brass.,Ralph Waldo Emerson,men
The revelation of thought takes men out of servitude into freedom.,Ralph Waldo Emerson,men
Good men must not obey the laws too well.,Ralph Waldo Emerson,men
"The reason why men do not obey us, is because they see the mud at the bottom of our eye.",Ralph Waldo Emerson,men
"Perfect friendship is the friendship of men who are good, and alike in excellence for these wish well alike to each other qua good, and they are good in themselves.",Aristotle,men
He who is cruel to animals becomes hard also in his dealings with men. We can judge the heart of a man by his treatment of animals.,Immanuel Kant,men
"It is a fact often observed, that men have written good verses under the inspiration of passion, who cannot write well under other circumstances.",Ralph Waldo Emerson,men
"The search after the great men is the dream of youth, and the most serious occupation of manhood.",Ralph Waldo Emerson,men
"Great men or men of great gifts you shall easily find, but symmetrical men never.",Ralph Waldo Emerson,men
"In every society some men are born to rule, and some to advise.",Ralph Waldo Emerson,men
Men acquire a particular quality by constantly acting in a particular way.,Aristotle,men
"Different men seek after happiness in different ways and by different means, and so make for themselves different modes of life and forms of government.",Aristotle,men
"It is clearly better that property should be private, but the use of it common and the special business of the legislator is to create in men this benevolent disposition.",Aristotle,men
"Let no one weep for me, or celebrate my funeral with mourning for I still live, as I pass to and fro through the mouths of men.",Quintus Ennius,men
Bachelors know more about women than married men if they didn't they'd be married too.,H. L. Mencken,men
"The man who makes everything that leads to happiness depends upon himself, and not upon other men, has adopted the very best plan for living happily. This is the man of moderation, the man of manly character and of wisdom.",Plato,men
"Those who excel in virtue have the best right of all to rebel, but then they are of all men the least inclined to do so.",Aristotle,men
"Men create gods after their own image, not only with regard to their form but with regard to their mode of life.",Aristotle,men
"All men make mistakes, but married men find out about them sooner.",Red Skelton,men
"The generality of men are naturally apt to be swayed by fear rather than reverence, and to refrain from evil rather because of the punishment that it brings than because of its own foulness.",Aristotle,men
"Choose silence of all virtues, for by it you hear other men's imperfections, and conceal your own.",George Bernard Shaw,men
"All men are children, and of one family. The same tale sends them all to bed, and wakes them in the morning.",Henry David Thoreau,men
Men are swayed more by fear than by reverence.,Aristotle,men
"It will be of little avail to the people that the laws are made by men of their own choice if the laws be so voluminous that they cannot be read, or so incoherent that they cannot be understood.",James Madison,men
"Of all religions, the Christian should of course inspire the most tolerance, but until now Christians have been the most intolerant of all men.",Voltaire,men
The first method for estimating the intelligence of a ruler is to look at the men he has around him.,Niccolo Machiavelli,men
"Stupid as a man, say the women: cowardly as a woman, say the men. Stupidity in a woman is unwomanly.",Friedrich Nietzsche,men
It is unbecoming for young men to utter maxims.,Aristotle,men
"Here in America we are descended in blood and in spirit from revolutionists and rebels - men and women who dare to dissent from accepted doctrine. As their heirs, may we never confuse honest dissent with disloyal subversion.",Dwight D. Eisenhower,men
How could man rejoice in victory and delight in the slaughter of men?,Lao Tzu,men
"Not necessity, not desire - no, the love of power is the demon of men. Let them have everything - health, food, a place to live, entertainment - they are and remain unhappy and low-spirited: for the demon waits and waits and will be satisfied.",Friedrich Nietzsche,men
A great value of antiquity lies in the fact that its writings are the only ones that modern men still read with exactness.,Friedrich Nietzsche,men
It doesn't take a hero to order men into battle. It takes a hero to be one of those men who goes into battle.,Norman Schwarzkopf,men
'Evil men have no songs.' How is it that the Russians have songs?,Friedrich Nietzsche,men
"I have never found a companion that was so companionable as solitude. We are for the most part more lonely when we go abroad among men than when we stay in our chambers. A man thinking or working is always alone, let him be where he will.",Henry David Thoreau,men
Ignorant men raise questions that wise men answered a thousand years ago.,Johann Wolfgang von Goethe,men
"The truth is, I've never fooled anyone. I've let men sometimes fool themselves.",Marilyn Monroe,men
"The fact is that I find more most men are more open, more generous, and much more stimulating than the majority of females I know.",Marilyn Monroe,men
Men who think that a woman's past love affairs lessen her love for them are usually stupid and weak.,Marilyn Monroe,men
"If you spend your life competing with business men, what do you have? A bank account and ulcers!",Marilyn Monroe,men
"When it comes to gossip, I have to readily admit men are as guilty as women.",Marilyn Monroe,men
I have noticed... that men usually leave married women alone and are inclined to treat all wives with respect. This is no great credit to married women.,Marilyn Monroe,men
Girls shouldn't worry about being the equal of men in the business world.,Marilyn Monroe,men
Marriage destroyed my relationship with two wonderful men.,Marilyn Monroe,men
I've found men are less likely to let petty things annoy them.,Marilyn Monroe,men
I think one of the basic reasons men make good friends is that they can make up their minds quickly.,Marilyn Monroe,men
"Black men don't like to be called 'boys,' but women accept being called 'girls.'",Marilyn Monroe,men
Women who seek to be equal with men lack ambition.,Marilyn Monroe,men
"Sometimes I've been to a party where no one spoke to me for a whole evening. The men, frightened by their wives or sweeties, would give me a wide berth. And the ladies would gang up in a corner to discuss my dangerous character.",Marilyn Monroe,men
"The working men, I'll go by and they'll whistle. At first they whistle because they think, 'Oh, it's a girl. She's got blond hair and she's not out of shape,' and then they say, 'Gosh, it's Marilyn Monroe!'",Marilyn Monroe,men
Justice means minding one's own business and not meddling with other men's concerns.,Plato,men
"Thank God men cannot fly, and lay waste the sky as well as the earth.",Henry David Thoreau,men
"There are people who want to make men's lives more difficult for no other reason than the chance it provides them afterwards to offer their prescription for alleviating life their Christianity, for instance.",Friedrich Nietzsche,men
"If women were particular about men's characters, they would never get married at all.",George Bernard Shaw,men
We sleep safe in our beds because rough men stand ready in the night to visit violence on those who would do us harm.,George Orwell,men
All the reasonings of men are not worth one sentiment of women.,Voltaire,men
"Wise men, when in doubt whether to speak or to keep quiet, give themselves the benefit of the doubt, and remain silent.",Napoleon Hill,men
"All men can see these tactics whereby I conquer, but what none can see is the strategy out of which victory is evolved.",Sun Tzu,men
"The Supreme Court has ruled that they cannot have a nativity scene in Washington, D.C. This wasn't for any religious reasons. They couldn't find three wise men and a virgin.",Jay Leno,men
"Beware, so long as you live, of judging men by their outward appearance.",Jean de La Fontaine,men
"Great indebtedness does not make men grateful, but vengeful and if a little charity is not forgotten, it turns into a gnawing worm.",Friedrich Nietzsche,men
"Little men with little minds and little imaginations go through life in little ruts, smugly resisting all changes which would jar their little worlds.",Zig Ziglar,men
"Great men, unknown to their generation, have their fame among the great who have preceded them, and all true worldly fame subsides from their high estimate beyond the stars.",Henry David Thoreau,men
"Regarding life, the wisest men of all ages have judged alike: it is worthless.",Friedrich Nietzsche,men
"Whoever has provoked men to rage against him has always gained a party in his favor, too.",Friedrich Nietzsche,men
"A return to first principles in a republic is sometimes caused by the simple virtues of one man. His good example has such an influence that the good men strive to imitate him, and the wicked are ashamed to lead a life so contrary to his example.",Niccolo Machiavelli,men
"While civilization has been improving our houses, it has not equally improved the men who are to inhabit them. It has created palaces, but it was not so easy to create noblemen and kings.",Henry David Thoreau,men
"When women go wrong, men go right after them.",Mae West,men
Men have become the tools of their tools.,Henry David Thoreau,men
"Men are not prisoners of fate, but only prisoners of their own minds.",Franklin D. Roosevelt,men
It is the most sensual men who need to flee women and torment their bodies.,Friedrich Nietzsche,men
"Civilization is the progress toward a society of privacy. The savage's whole existence is public, ruled by the laws of his tribe. Civilization is the process of setting man free from men.",Ayn Rand,men
"In the course of history, men come to see that iron necessity is neither iron nor necessary.",Friedrich Nietzsche,men
"Mothers - especially single mothers - are heroic in their efforts to raise our nation's children, but men must also take responsibility for their children and recognize the impact they have on their families' well-being.",Evan Bayh,men
Being the boss anywhere is lonely. Being a female boss in a world of mostly men is especially so.,Robert Frost,men
"In the long run, men hit only what they aim at. Therefore, they had better aim at something high.",Henry David Thoreau,men
"I have often wondered how it is that every man loves himself more than all the rest of men, but yet sets less value on his own opinions of himself than on the opinions of others.",Marcus Aurelius,men
"Power does not corrupt men fools, however, if they get into a position of power, corrupt power.",George Bernard Shaw,men
Few men have virtue to withstand the highest bidder.,George Washington,men
It is an interesting question how far men would retain their relative rank if they were divested of their clothes.,Henry David Thoreau,men
"Ten men waiting for me at the door? Send one of them home, I'm tired.",Mae West,men
"If you would convince a man that he does wrong, do right. Men will believe what they see.",Henry David Thoreau,men
The law will never make a man free it is men who have got to make the law free.,Henry David Thoreau,men
Love is something far more than desire for sexual intercourse it is the principal means of escape from the loneliness which afflicts most men and women throughout the greater part of their lives.,Bertrand Russell,men
"We know but a few men, a great many coats and breeches.",Henry David Thoreau,men
"Instead of noblemen, let us have noble villages of men.",Henry David Thoreau,men
Men have a respect for scholarship and learning greatly out of proportion to the use they commonly serve.,Henry David Thoreau,men
"I have thought there was some advantage even in death, by which we mingle with the herd of common men.",Henry David Thoreau,men
One machine can do the work of fifty ordinary men. No machine can do the work of one extraordinary man.,Elbert Hubbard,men
"All men are born with a nose and ten fingers, but no one was born with a knowledge of God.",Voltaire,men
"Things that I felt absolutely sure of but a few years ago, I do not believe now. This thought makes me see more clearly how foolish it would be to expect all men to agree with me.",Jim Rohn,men
"I'm supposed to have a Ph.D. on the subject of women. But the truth is I've flunked more often than not. I'm very fond of women I admire them. But, like all men, I don't understand them.",Frank Sinatra,men
"Men make history and not the other way around. In periods where there is no leadership, society stands still. Progress occurs when courageous, skillful leaders seize the opportunity to change things for the better.",Harry S. Truman,men
"An American monkey, after getting drunk on brandy, would never touch it again, and thus is much wiser than most men.",Charles Darwin,men
Until the men of action clear out the talkers we who have social consciences are at the mercy of those who have none.,George Bernard Shaw,men
Old men are dangerous: it doesn't matter to them what is going to happen to the world.,George Bernard Shaw,men
Life levels all men. Death reveals the eminent.,George Bernard Shaw,men
Men and women belong to different species and communications between them is still in its infancy.,Bill Cosby,men
Nothing is ever done in this world until men are prepared to kill one another if it is not done.,George Bernard Shaw,men
We learn from experience that men never learn anything from experience.,George Bernard Shaw,men
Men have to do some awfully mean things to keep up their respectability.,George Bernard Shaw,men
"Men are wise in proportion, not to their experience, but to their capacity for experience.",George Bernard Shaw,men
Men must live and create. Live to the point of tears.,Albert Camus,men
"Christmas in Bethlehem. The ancient dream: a cold, clear night made brilliant by a glorious star, the smell of incense, shepherds and wise men falling to their knees in adoration of the sweet baby, the incarnation of perfect love.",Lucinda Franks,men
I am looking for a lot of men who have an infinite capacity to not know what can't be done.,Henry Ford,men
"A woman who is willing to be herself and pursue her own potential runs not so much the risk of loneliness, as the challenge of exposure to more interesting men - and people in general.",Lorraine Hansberry,men
"The truth is not for all men, but only for those who seek it.",Ayn Rand,men
We have now sunk to a depth at which restatement of the obvious is the first duty of intelligent men.,George Orwell,men
"Wars may be fought with weapons, but they are won by men. It is the spirit of men who follow and of the man who leads that gains the victory.",George S. Patton,men
Big jobs usually go to the men who prove their ability to outgrow small ones.,Theodore Roosevelt,men
Men are only as great as they are kind.,Elbert Hubbard,men
Men are so simple and so much inclined to obey immediate needs that a deceiver will never lack victims for his deceptions.,Niccolo Machiavelli,men
"Men are convinced of your arguments, your sincerity, and the seriousness of your efforts only by your death.",Albert Camus,men
Let your Discourse with Men of Business be Short and Comprehensive.,George Washington,men
"If any civilization is to survive, it is the morality of altruism that men have to reject.",Ayn Rand,men
Reputation is what men and women think of us character is what God and angels know of us.,Thomas Paine,men
Hockey is a sport for white men. Basketball is a sport for black men. Golf is a sport for white men dressed like black pimps.,Tiger Woods,men
"Wisdom is the right use of knowledge. To know is not to be wise. Many men know a great deal, and are all the greater fools for it. There is no fool so great a fool as a knowing fool. But to know how to use knowledge is to have wisdom.",Charles Spurgeon,men
"The reason men oppose progress is not that they hate progress, but that they love inertia.",Elbert Hubbard,men
"Adversity makes men, and prosperity makes monsters.",Victor Hugo,men
Death is not the worst that can happen to men.,Plato,men
"All women have a perception much more developed than men. So all women somehow, being repressed for so many millennia, they ended up by developing this sixth sense and contemplation and love. And this is something that we have a hard time to accept as part of our society.",Paulo Coelho,men
"A little philosophy inclineth man's mind to atheism, but depth in philosophy bringeth men's minds about to religion.",Francis Bacon,men
"It's not the men in my life that count, it's the life in my men.",Mae West,men
"When Jesus comes back, these crazy, greedy, capitalistic men are gonna kill him again.",Mike Tyson,men
The majority of men meet with failure because of their lack of persistence in creating new plans to take the place of those which fail.,Napoleon Hill,men
Women who seek to be equal with men lack ambition.,Timothy Leary,men
Culture: the cry of men in face of their destiny.,Albert Camus,men
"The punishment which the wise suffer who refuse to take part in the government, is to live under the government of worse men.",Plato,men
Men are never really willing to die except for the sake of freedom: therefore they do not believe in dying completely.,Albert Camus,men
"The Bible is one of the greatest blessings bestowed by God on the children of men. It has God for its author salvation for its end, and truth without any mixture for its matter. It is all pure.",John Locke,men
Only free men can negotiate prisoners cannot enter into contracts. Your freedom and mine cannot be separated.,Nelson Mandela,men
"Men should be either treated generously or destroyed, because they take revenge for slight injuries - for heavy ones they cannot.",Niccolo Machiavelli,men
The savior who wants to turn men into angels is as much a hater of human nature as the totalitarian despot who wants to turn them into puppets.,Eric Hoffer,men
Liberate the minds of men and ultimately you will liberate the bodies of men.,Marcus Garvey,men
"You will find men who want to be carried on the shoulders of others, who think that the world owes them a living. They don't seem to see that we must all lift together and pull together.",Henry Ford,men
"But while they prate of economic laws, men and women are starving. We must lay hold of the fact that economic laws are not made by nature. They are made by human beings.",Franklin D. Roosevelt,men
Adversity causes some men to break others to break records.,William Arthur Ward,men
"I think the part of media that romanticizes criminal behavior, things that a person will say against women, profanity, being gangster, having multiple children with multiple men and women and not wanting to is prevalent. When you look at the majority of shows on television they placate that kind of behavior.",Bill Cosby,men
Some men can live up to their loftiest ideals without ever going higher than a basement.,Theodore Roosevelt,men
Tears are often the telescope by which men see far into heaven.,Henry Ward Beecher,men
A strong argument for the religion of Christ is this - that offences against Charity are about the only ones which men on their death-beds can be made - not to understand - but to feel - as crime.,Edgar Allan Poe,men
