"Men often pass from love to ambition, but they seldom come back again from ambition to love.",Francois de La Rochefoucauld,men
"History has taught us over and over again that freedom is not free. When push comes to shove, the ultimate protectors of freedom and liberty are the brave men and women in our armed forces. Throughout our history, they've answered the call in bravery and sacrifice.",Tim Pawlenty,men
"As soon as men decide that all means are permitted to fight an evil, then their good becomes indistinguishable from the evil that they set out to destroy.",Christopher Dawson,men
"It might be pardonable to refuse to defend some men, but to defend them negligently is nothing short of criminal.",Marcus Tullius Cicero,men
"When I was a boy, the Sioux owned the world. The sun rose and set on their land they sent ten thousand men to battle. Where are the warriors today? Who slew them? Where are our lands? Who owns them?",Sitting Bull,men
"Men would live exceedingly quiet if these two words, mine and thine, were taken away.",Anaxagoras,men
"Grown men can learn from very little children for the hearts of little children are pure. Therefore, the Great Spirit may show to them many things which older people miss.",Black Elk,men
"Two things control men's nature, instinct and experience.",Blaise Pascal,men
Older men declare war. But it is the youth that must fight and die.,Herbert Hoover,men
Great things are done when men and mountains meet.,William Blake,men
Men are not great or small because of their material possessions. They are great or small because of what they are.,James Cash Penney,men
"It is easier to lead men to combat, stirring up their passion, than to restrain them and direct them toward the patient labors of peace.",Andre Gide,men
Men despise religion. They hate it and are afraid it may be true.,Blaise Pascal,men
Decisiveness is a characteristic of high-performing men and women. Almost any decision is better than no decision at all.,Brian Tracy,men
There is no better proof of a man's being truly good than his desiring to be constantly under the observation of good men.,Francois de La Rochefoucauld,men
"A family is a unit composed not only of children but of men, women, an occasional animal, and the common cold.",Ogden Nash,men
It is not in the nature of politics that the best men should be elected. The best men do not want to govern their fellowmen.,George MacDonald,men
"All soldiers who serve their country and put their lives at risk need to know that if something happens to them, their families will be well taken care of. That's the bond we have with our military men and women and their families.",Jeff Sessions,men
"We need men with moral courage to speak and write their real thoughts, and to stand by their convictions, even to the very death.",Robert Green Ingersoll,men
"Live as brave men and if fortune is adverse, front its blows with brave hearts.",Marcus Tullius Cicero,men
I get along with guys most of my friends are guys. It's easier to trust men sometimes. I only have a few close girlfriends that I trust.,Paris Hilton,men
I was surrounded by strong women so it had never even occurred to me that women were anything other than equal to men.,David Bailey,men
A good boss makes his men realize they have more ability than they think they have so that they consistently do better work than they thought they could.,Charles Erwin Wilson,men
"Although I do wrong, I do not the wrongs that I am charged with doing the wrong that I do is through the frailty of human nature, like other men. No man lives without fault.","Joseph Smith, Jr.",men
The happiness and misery of men depend no less on temper than fortune.,Francois de La Rochefoucauld,men
I'm done with men... I'm going to be alone. I have no luck with relationships. I don't think I'm made for marriage.,Halle Berry,men
"Most people know no other way of judging men's worth but by the vogue they are in, or the fortunes they have met with.",Francois de La Rochefoucauld,men
"A silent man is easily reputed wise. A man who suffers none to see him in the common jostle and undress of life, easily gathers round him a mysterious veil of unknown sanctity, and men honor him for a saint. The unknown is always wonderful.",Frederick William Robertson,men
Violence and arms can never resolve the problems of men.,Pope John Paul II,men
Men always talk about the most important things to perfect strangers. In the perfect stranger we perceive man himself the image of a God is not disguised by resemblances to an uncle or doubts of wisdom of a mustache.,Gilbert K. Chesterton,men
It is difficult for a woman to define her feelings in language which is chiefly made by men to express theirs.,Thomas Hardy,men
"Most men are very attached to the idea of being male, and usually experience a lot of fear and insecurity around the idea of being a man. Most women are very identified with their gender, and also experience a tremendous amount of fear and insecurity.",Andrew Cohen,men
Men do not have to cook their food they do so for symbolic reasons to show they are men and not beasts.,Edmund Leach,men
Something unpleasant is coming when men are anxious to tell the truth.,Benjamin Disraeli,men
"Men are so necessarily mad, that not to be mad would amount to another form of madness.",Blaise Pascal,men
A time will come when a politician who has willfully made war and promoted international dissension will be as sure of the dock and much surer of the noose than a private homicide. It is not reasonable that those who gamble with men's lives should not stake their own.,H. G. Wells,men
"If there existed no external means for dimming their consciences, one-half of the men would at once shoot themselves, because to live contrary to one's reason is a most intolerable state, and all men of our time are in such a state.",Leo Tolstoy,men
"False happiness renders men stern and proud, and that happiness is never communicated. True happiness renders them kind and sensible, and that happiness is always shared.",Charles de Montesquieu,men
"I know there is a Supreme Being who rules the affairs of men and whose goodness and mercy have always followed the American people, and I know He will not turn from us now if we humbly and reverently seek His powerful aid.",Grover Cleveland,men
Men's ideas are the most direct emanations of their material state.,Karl Marx,men
"Give to everyone who begs from you and of him who takes away your goods do not ask them again. And as you wish that men would do to you, do so to them.",Jesus Christ,men
"For real change, we need feminine energy in the management of the world. We need a critical number of women in positions of power, and we need to nurture the feminine energy in men.",Isabel Allende,men
"Love, it has been said, flows downward. The love of parents for their children has always been far more powerful than that of children for their parents and who among the sons of men ever loved God with a thousandth part of the love which God has manifested to us?",Augustus Hare,men
"Moderation has been called a virtue to limit the ambition of great men, and to console undistinguished people for their want of fortune and their lack of merit.",Benjamin Disraeli,men
"The men who learn endurance, are they who call the whole world, brother.",Charles Dickens,men
A little nonsense now and then is relished by the wisest men.,Roald Dahl,men
"Some men never feel small, but these are the few men who are.",Gilbert K. Chesterton,men
Make no little plans they have no magic to stir men's blood.,Daniel Burnham,men
What affects men sharply about a foreign nation is not so much finding or not finding familiar things it is rather not finding them in the familiar place.,Gilbert K. Chesterton,men
"All men should strive to learn before they die, what they are running from, and to, and why.",James Thurber,men
"Some people think having large breasts makes a woman stupid. Actually, it's quite the opposite: a woman having large breasts makes men stupid.",Rita Rudner,men
Men are liars. We'll lie about lying if we have to. I'm an algebra liar. I figure two good lies make a positive.,Tim Allen,men
"If men and women are to understand each other, to enter into each other's nature with mutual sympathy, and to become capable of genuine comradeship, the foundation must be laid in youth.",Havelock Ellis,men
"Many men have been capable of doing a wise thing, more a cunning thing, but very few a generous thing.",Alexander Pope,men
I love being a woman and I was not one of these women who rose through professional life by wearing men's clothes or looking masculine. I loved wearing bright colors and being who I am.,Madeleine Albright,men
The story of the human race is the story of men and women selling themselves short.,Abraham Maslow,men
"If it's natural to kill, how come men have to go into training to learn how?",Joan Baez,men
"Our duty, as men and women, is to proceed as if limits to our ability did not exist. We are collaborators in creation.",Pierre Teilhard de Chardin,men
"It is the dissimilarities and inequalities among men which give rise to the notion of honor as such differences become less, it grows feeble and when they disappear, it will vanish too.",Alexis de Tocqueville,men
"Men are disturbed not by things, but by the view which they take of them.",Epictetus,men
"And remember, where you have a concentration of power in a few hands, all too frequently men with the mentality of gangsters get control. History has proven that.",Lord Acton,men
"In reading the lives of great men, I found that the first victory they won was over themselves... self-discipline with all of them came first.",Harry S. Truman,men
"It is generally recognised that women are better than men at languages, personal relations and multi-tasking, but less good at map-reading and spatial awareness. It is therefore not unreasonable to suppose that women might be less good at mathematics and physics.",Stephen Hawking,men
Men blaspheme what they do not know.,Blaise Pascal,men
"The greater intellect one has, the more originality one finds in men. Ordinary persons find no difference between men.",Blaise Pascal,men
"If men are honest, everything they do and everywhere they go is for a chance to see women.",Jack Nicholson,men
"To tax and to please, no more than to love and to be wise, is not given to men.",Edmund Burke,men
There are one hundred men seeking security to one able man who is willing to risk his fortune.,J. Paul Getty,men
"It is, generally, in the season of prosperity that men discover their real temper, principles, and designs.",Edmund Burke,men
"I think that the day you've figured out the differences between women and men is the day that you're no longer attracted to women. It's the difference that is so fantastic and frustrating and angering, and really sexy.",Kiefer Sutherland,men
"Produce great men, the rest follows.",Walt Whitman,men
"Wives are young men's mistresses, companions for middle age, and old men's nurses.",Francis Bacon,men
All men having power ought to be distrusted to a certain degree.,James Madison,men
"Great men are like eagles, and build their nest on some lofty solitude.",Arthur Schopenhauer,men
"Such is the nature of men, that howsoever they may acknowledge many others to be more witty, or more eloquent, or more learned yet they will hardly believe there be many so wise as themselves.",Thomas Hobbes,men
Men are by nature merely indifferent to one another but women are by nature enemies.,Arthur Schopenhauer,men
All men profess honesty as long as they can. To believe all men honest would be folly. To believe none so is something worse.,John Quincy Adams,men
"I am truly free only when all human beings, men and women, are equally free. The freedom of other men, far from negating or limiting my freedom, is, on the contrary, its necessary premise and confirmation.",Mikhail Bakunin,men
"All men are created equal, it is only men themselves who place themselves above equality.",David Allan Coe,men
"You should read history and look at ostracism, persecution, martyrdom, and that kind of thing. They always happen to the best men, you know.",George Eliot,men
Women think with their whole bodies and they see things as a whole more than men do.,Dorothy Day,men
"If I err in belief that the souls of men are immortal, I gladly err, nor do I wish this error which gives me pleasure to be wrested from me while I live.",Marcus Tullius Cicero,men
"Men are born with two eyes, but with one tongue, in order that they should see twice as much as they say.",Charles Caleb Colton,men
"Forgive, son men are men they needs must err.",Euripides,men
"No lying knight or lying priest ever prospered in any age, but especially not in the dark ones. Men prospered then only in following an openly declared purpose, and preaching candidly beloved and trusted creeds.",John Ruskin,men
"We all fight over what the label 'feminism' means but for me it's about empowerment. It's not about being more powerful than men - it's about having equal rights with protection, support, justice. It's about very basic things. It's not a badge like a fashion item.",Annie Lennox,men
Nothing doth more hurt in a state than that cunning men pass for wise.,Francis Bacon,men
It is a sad thing when men have neither the wit to speak well nor the judgment to hold their tongues.,Jean de la Bruyere,men
Men often take their imagination for their heart and they believe they are converted as soon as they think of being converted.,Blaise Pascal,men
Many men are contemptuous of riches few can give them away.,Francois de La Rochefoucauld,men
"When women are depressed, they eat or go shopping. Men invade another country. It's a whole different way of thinking.",Elayne Boosler,men
There are but very few men clever enough to know all the mischief they do.,Francois de La Rochefoucauld,men
"The production of children, the nurture of those born, and the daily life of men, of these matters woman is visibly the cause.",Guru Nanak,men
"Being a woman is a terribly difficult task, since it consists principally in dealing with men.",Joseph Conrad,men
A good part - and definitely the most fun part - of being a feminist is about frightening men.,Julie Burchill,men
"If boyhood and youth are but vanity, must it not be our ambition to become men?",Vincent Van Gogh,men
"Millions of men have lived to fight, build palaces and boundaries, shape destinies and societies but the compelling force of all times has been the force of originality and creation profoundly affecting the roots of human spirit.",Ansel Adams,men
"Monkeys are superior to men in this: when a monkey looks into a mirror, he sees a monkey.",Malcolm De Chazal,men
"We do not want the men of another color for our brothers-in-law, but we do want them for our brothers.",Booker T. Washington,men
"Money is the worst currency that ever grew among mankind. This sacks cities, this drives men from their homes, this teaches and corrupts the worthiest minds to turn base deeds.",Sophocles,men
A great deal of talent is lost to the world for want of a little courage. Every day sends to their graves obscure men whose timidity prevented them from making a first effort.,Sydney Smith,men
"All men are liable to error and most men are, in many points, by passion or interest, under temptation to it.",John Locke,men
"Man is not the creature of circumstances, circumstances are the creatures of men. We are free agents, and man is more powerful than matter.",Benjamin Disraeli,men
Here men from the planet Earth first set foot upon the Moon. July 1969 AD. We came in peace for all mankind.,Neil Armstrong,men
"But men must know, that in this theatre of man's life it is reserved only for God and angels to be lookers on.",Francis Bacon,men
"It's rather splendid to think of all those great men and women who appear to have presented symptoms that allow us to describe them as bipolar. Whether it's Hemingway, Van Gogh... Robert Schumann has been mentioned... Virginia Woolf, Sylvia Plath... some of them with rather grim ends.",Stephen Fry,men
"Men are able to trust one another, knowing the exact degree of dishonesty they are entitled to expect.",Stephen Leacock,men
"When I was younger, I was terrified to express anger because it would often kick-start a horrible reaction in the men in my life. So I bit my tongue. I was left to painstakingly deal with the aftermath of my avoidance later in life, in therapy or through the lyrics of my songs.",Alanis Morissette,men
Men know everything - all of them - all the time - no matter how stupid or inexperienced or arrogant or ignorant they are.,Andrea Dworkin,men
"Women's fashion is a subtle form of bondage. It's men's way of binding them. We put them in these tight, high-heeled shoes, we make them wear these tight clothes and we say they look sexy. But they're actually tied up.",David Duchovny,men
All men of action are dreamers.,James Huneker,men
Justice consists in doing no injury to men decency in giving them no offense.,Marcus Tullius Cicero,men
There are more men ennobled by study than by nature.,Marcus Tullius Cicero,men
We must conceive of this whole universe as one commonwealth of which both gods and men are members.,Marcus Tullius Cicero,men
The worst men often give the best advice.,Francis Bacon,men
"Men will bear many things from a kept mistress, which they would not bear from a wife.",Samuel Richardson,men
I do not wish women to have power over men but over themselves.,Mary Wollstonecraft Shelley,men
Old men are fond of giving good advice to console themselves for their inability to give bad examples.,Francois de La Rochefoucauld,men
"It is easier to know men in general, than men in particular.",Francois de La Rochefoucauld,men
No longer shall I paint interiors with men reading and women knitting. I will paint living people who breathe and feel and suffer and love.,Edvard Munch,men
"Few things are impracticable in themselves and it is for want of application, rather than of means, that men fail to succeed.",Francois de La Rochefoucauld,men
There are a great many men valued in society who have nothing to recommend them but serviceable vices.,Francois de La Rochefoucauld,men
There is nothing men are so generous of as advice.,Francois de La Rochefoucauld,men
"Men know they are sexual exiles. They wander the earth seeking satisfaction, craving and despising, never content. There is nothing in that anguished motion for women to envy.",Camille Paglia,men
No men are oftener wrong than those that can least bear to be so.,Francois de La Rochefoucauld,men
We are all strong enough to bear other men's misfortunes.,Francois de La Rochefoucauld,men
"Though men are apt to flatter and exalt themselves with their great achievements, yet these are, in truth, very often owing not so much to design as chance.",Francois de La Rochefoucauld,men
"As to the deceit perpetrated upon women, let it pass, for, when love is in the way, men and women as a general rule dupe each other.",Giacomo Casanova,men
"What is most important for democracy is not that great fortunes should not exist, but that great fortunes should not remain in the same hands. In that way there are rich men, but they do not form a class.",Alexis de Tocqueville,men
The vote is the most powerful instrument ever devised by man for breaking down injustice and destroying the terrible walls which imprison men because they are different from other men.,Lyndon B. Johnson,men
We should have a State in which we could live and breathe as free men and which we could develop according to our own lights and culture and where principles of Islamic social justice could find free play.,Muhammad Ali Jinnah,men
"Give me six lines written by the most honorable of men, and I will find an excuse in them to hang him.",Cardinal Richelieu,men
When men sow the wind it is rational to expect that they will reap the whirlwind.,Frederick Douglass,men
"Education then, beyond all other devices of human origin, is the great equalizer of the conditions of men, the balance-wheel of the social machinery.",Horace Mann,men
"Fame and power are the objects of all men. Even their partial fruition is gained by very few and that, too, at the expense of social pleasure, health, conscience, life.",Benjamin Disraeli,men
"As Americans, we don't see the role of government as guaranteeing outcomes, but allowing free men and women to flourish based on their own vision, their hard work and their personal responsibility.",Rick Perry,men
Wise men make more opportunities than they find.,Francis Bacon,men
Men who want to support women in our struggle for freedom and justice should understand that it is not terrifically important to us that they learn to cry it is important to us that they stop the crimes of violence against us.,Andrea Dworkin,men
"At the bottom of not a little of the bravery that appears in the world, there lurks a miserable cowardice. Men will face powder and steel because they have not the courage to face public opinion.",Edwin Hubbel Chapin,men
"What is the price of experience? Do men buy it for a song? Or wisdom for a dance in the street? No, it is bought with the price of all the man hath, his house, his wife, his children.",William Blake,men
"Men die in despair, while spirits die in ecstasy.",Honore de Balzac,men
"Punishment is now unfashionable... because it creates moral distinctions among men, which, to the democratic mind, are odious. We prefer a meaningless collective guilt to a meaningful individual responsibility.",Thomas Szasz,men
"It disturbs me no more to find men base, unjust, or selfish than to see apes mischievous, wolves savage, or the vulture ravenous.",Jean-Paul Sartre,men
"An artist needn't be a clergyman or a churchwarden, but he certainly must have a warm heart for his fellow men.",Vincent Van Gogh,men
It is our duty as men and women to proceed as though the limits of our abilities do not exist.,Pierre Teilhard de Chardin,men
"Labor disgraces no man unfortunately, you occasionally find men who disgrace labor.",Ulysses S. Grant,men
We cannot learn men from books.,Benjamin Disraeli,men
The best teamwork comes from men who are working independently toward one goal in unison.,James Cash Penney,men
"Most men are individuals no longer so far as their business, its activities, or its moralities are concerned. They are not units but fractions.",Charles Dickens,men
"It is not because angels are holier than men or devils that makes them angels, but because they do not expect holiness from one another, but from God only.",William Blake,men
The unique and supreme voluptuousness of love lies in the certainty of committing evil. And men and women know from birth that in evil is found all sensual delight.,Charles Baudelaire,men
I have known more men destroyed by the desire to have wife and child and to keep them in comfort than I have seen destroyed by drink and harlots.,William Butler Yeats,men
"It is not true that suffering ennobles the character happiness does that sometimes, but suffering for the most part, makes men petty and vindictive.",W. Somerset Maugham,men
It is a clear truth that those who every day barter away other men's liberty will soon care little for their own.,James Otis,men
"A strong hatred is the best lamp to bear in our hands as we go over the dark places of life, cutting away the dead things men tell us to revere.",Rebecca West,men
The important work of moving the world forward does not wait to be done by perfect men.,George Eliot,men
"Much may be done in those little shreds and patches of time which every day produces, and which most men throw away.",Charles Caleb Colton,men
"Men should be like Kleenex, soft, strong and disposable.",Cher,men
"Men do change, and change comes like a little wind that ruffles the curtains at dawn, and it comes like the stealthy perfume of wildflowers hidden in the grass.",John Steinbeck,men
The strength and power of a country depends absolutely on the quantity of good men and women in it.,John Ruskin,men
"The only language men ever speak perfectly is the one they learn in babyhood, when no one can teach them anything!",Maria Montessori,men
The average bright young man who is drafted hates the whole business because an army always tries to eliminate the individual differences in men.,Andy Rooney,men
I have known war as few men now living know it. It's very destructiveness on both friend and foe has rendered it useless as a means of settling international disputes.,Douglas MacArthur,men
"Men, their rights, and nothing more women, their rights, and nothing less.",Susan B. Anthony,men
"Women, as they grow older, rely more and more on cosmetics. Men, as they grow older, rely more and more on a sense of humor.",George Jean Nathan,men
I once heard two ladies going on and on about the pains of childbirth and how men don't seem to know what real pain is. I asked if either of them ever got themselves caught in a zipper.,Emo Philips,men
Only men who are not interested in women are interested in women's clothes. Men who like women never notice what they wear.,Anatole France,men
"To judge from the notions expounded by theologians, one must conclude that God created most men simply with a view to crowding hell.",Marquis de Sade,men
"As soon as laws are necessary for men, they are no longer fit for freedom.",Pythagoras,men
We must make it clear that a platform of 'I hate gay men and women' is not a way to become president of the United States.,Jimmy Carter,men
"Either war is obsolete, or men are.",R. Buckminster Fuller,men
"Ah, lives of men! When prosperous they glitter - Like a fair picture when misfortune comes - A wet sponge at one blow has blurred the painting.",Aeschylus,men
"Men do not shape destiny, Destiny produces the man for the hour.",Fidel Castro,men
Married men live longer than single men. But married men are a lot more willing to die.,Johnny Carson,men
