It is easier to build strong children than to repair broken men.,Frederick Douglass,men
"I, with a deeper instinct, choose a man who compels my strength, who makes enormous demands on me, who does not doubt my courage or my toughness, who does not believe me naive or innocent, who has the courage to treat me like a woman.",Anais Nin,men
Men always want to be a woman's first love - women like to be a man's last romance.,Oscar Wilde,men
"Without feelings of respect, what is there to distinguish men from beasts?",Confucius,men
Man becomes great exactly in the degree in which he works for the welfare of his fellow-men.,Mahatma Gandhi,men
"I look only to the good qualities of men. Not being faultless myself, I won't presume to probe into the faults of others.",Mahatma Gandhi,men
"Women love us for our defects. If we have enough of them, they will forgive us everything, even our gigantic intellects.",Oscar Wilde,men
A man's kiss is his signature.,Mae West,men
The superior man is distressed by the limitations of his ability he is not distressed by the fact that men do not recognize the ability that he has.,Confucius,men
"If you have men who will exclude any of God's creatures from the shelter of compassion and pity, you will have men who will deal likewise with their fellow men.",Francis of Assisi,men
The mass of men lead lives of quiet desperation. What is called resignation is confirmed desperation.,Henry David Thoreau,men
"When a hundred men stand together, each of them loses his mind and gets another one.",Friedrich Nietzsche,men
"Men are born to succeed, not to fail.",Henry David Thoreau,men
Liberty means responsibility. That is why most men dread it.,George Bernard Shaw,men
One man that has a mind and knows it can always beat ten men who haven't and don't.,George Bernard Shaw,men
A gentleman is simply a patient wolf.,Lana Turner,men
The greatest deception men suffer is from their own opinions.,Leonardo da Vinci,men
I only have 'yes' men around me. Who needs 'no' men?,Mae West,men
"Men rise from one ambition to another: first, they seek to secure themselves against attack, and then they attack others.",Niccolo Machiavelli,men
A bachelor is a guy who never made the same mistake once.,Phyllis Diller,men
"I usually make up my mind about a man in ten seconds, and I very rarely change it.",Margaret Thatcher,men
"I only like two kinds of men, domestic and imported.",Mae West,men
"Man as an individual is a genius. But men in the mass form the headless monster, a great, brutish idiot that goes where prodded.",Charlie Chaplin,men
Honor is simply the morality of superior men.,H. L. Mencken,men
Men must know their limitations.,Clint Eastwood,men
"Boys will be boys, and so will a lot of middle-aged men.",Kin Hubbard,men
"Passion makes idiots of the cleverest men, and makes the biggest idiots clever.",Francois de La Rochefoucauld,men
The truth is found when men are free to pursue it.,Franklin D. Roosevelt,men
Men are more easily governed through their vices than through their virtues.,Napoleon Bonaparte,men
Men shrink less from offending one who inspires love than one who inspires fear.,Niccolo Machiavelli,men
"If so many men, so many minds, certainly so many hearts, so many kinds of love.",Leo Tolstoy,men
"Men are like steel. When they lose their temper, they lose their worth.",Chuck Norris,men
Men can only be happy when they do not assume that the object of life is happiness.,George Orwell,men
There are only two forces that unite men - fear and interest.,Napoleon Bonaparte,men
"For many men, the acquisition of wealth does not end their troubles, it only changes them.",Lucius Annaeus Seneca,men
I have always thought the actions of men the best interpreters of their thoughts.,John Locke,men
"'Tis easy enough to be pleasant, When life flows along like a song But the man worth while is the one who will smile when everything goes dead wrong.",Ella Wheeler Wilcox,men
Men are only as good as their technical development allows them to be.,George Orwell,men
Men of lofty genius when they are doing the least work are most active.,Leonardo da Vinci,men
Treat all men alike. Give them the same law. Give them an even chance to live and grow.,Chief Joseph,men
"Women prefer to talk in twos, while men prefer to talk in threes.",Gilbert K. Chesterton,men
"Men become much more attractive when they start looking older. But it doesn't do much for women, though we do have an advantage: make-up.",Bette Davis,men
"It is a truth universally acknowledged, that a single man in possession of a good fortune, must be in want of a wife.",Jane Austen,men
Beauty makes idiots sad and wise men merry.,George Jean Nathan,men
"Time destroys the speculation of men, but it confirms nature.",Marcus Tullius Cicero,men
Great men are seldom over-scrupulous in the arrangement of their attire.,Charles Dickens,men
Men do not quit playing because they grow old they grow old because they quit playing.,Oliver Wendell Holmes,men
Men give away nothing so liberally as their advice.,Francois de La Rochefoucauld,men
Men get to be a mixture of the charming mannerisms of the women they have known.,F. Scott Fitzgerald,men
The first rule of business is: Do other men for they would do you.,Charles Dickens,men
I am an agnostic I do not pretend to know what many ignorant men are sure of.,Clarence Darrow,men
"Certainly the best works, and of greatest merit for the public, have proceeded from the unmarried, or childless men.",Francis Bacon,men
By indignities men come to dignities.,Francis Bacon,men
Many men owe the grandeur of their lives to their tremendous difficulties.,Charles Spurgeon,men
All men were made by the Great Spirit Chief. They are all brothers.,Chief Joseph,men
"Do not trust all men, but trust men of worth the former course is silly, the latter a mark of prudence.",Democritus,men
"Men are not punished for their sins, but by them.",Kin Hubbard,men
"When men and women agree, it is only in their conclusions their reasons are always different.",George Santayana,men
Those men get along best with women who can get along best without them.,Charles Baudelaire,men
There is no such thing as justice in the abstract it is merely a compact between men.,Epicurus,men
"In life we shall find many men that are great, and some that are good, but very few men that are both great and good.",Charles Caleb Colton,men
The duty of comedy is to correct men by amusing them.,Moliere,men
Nothing is as peevish and pedantic as men's judgments of one another.,Desiderius Erasmus,men
Men's arguments often prove nothing but their wishes.,Charles Caleb Colton,men
"Pride, envy, avarice - these are the sparks have set on fire the hearts of all men.",Dante Alighieri,men
Luck is not something you can mention in the presence of self-made men.,E. B. White,men
"Men are freest when they are most unconscious of freedom. The shout is a rattling of chains, always was.",David Herbert Lawrence,men
Men won't read any email from a woman that's over 200 words long.,Doug Coupland,men
All men who have turned out worth anything have had the chief hand in their own education.,Walter Scott,men
There would be no great men if there were no little ones.,George Herbert,men
"It is the privilege of the gods to want nothing, and of godlike men to want little.",Diogenes,men
"When two men in business always agree, one of them is unnecessary.",Ezra Pound,men
Men aren't necessities. They're luxuries.,Cher,men
Men and women have strengths that complement each other.,Edwin Louis Cole,men
It's at the borders of pain and suffering that the men are separated from the boys.,Emil Zatopek,men
"Most men, when they think they are thinking, are merely rearranging their prejudices.",Knute Rockne,men
"One must judge men not by their opinions, but by what their opinions have made of them.",Georg C. Lichtenberg,men
"He was one of those men who possess almost every gift, except the gift of the power to use them.",Charles Kingsley,men
Circumstances rule men men do not rule circumstances.,Herodotus,men
"Men, as well as women, are much oftener led by their hearts than by their understandings.",Lord Chesterfield,men
"Whatever makes men good Christians, makes them good citizens.",Daniel Webster,men
Men should strive to think much and know little.,Democritus,men
"Nothing great will ever be achieved without great men, and men are great only if they are determined to be so.",Charles de Gaulle,men
Men tire themselves in pursuit of rest.,Laurence Sterne,men
Men often act knowingly against their interest.,David Hume,men
"The less men think, the more they talk.",Charles de Montesquieu,men
Men tend to feel threatened women tend to feel guilty.,Edwin Louis Cole,men
"Men, even when alone, lighten their labors by song, however rude it may be.",Quintilian,men
"Deliberation is the work of many men. Action, of one alone.",Charles de Gaulle,men
"Like all young men I set out to be a genius, but mercifully laughter intervened.",Lawrence Durrell,men
For tis not in mere death that men die most.,Elizabeth Barrett Browning,men
Men do not fail they give up trying.,Elihu Root,men
"Men are like sheep, of which a flock is more easily driven than a single one.",Richard Whately,men
I have always supported measures and principles and not men.,Davy Crockett,men
Time takes away the grief of men.,Desiderius Erasmus,men
"If the world were a logical place, men would ride side saddle.",Rita Mae Brown,men
"By nature, men love newfangledness.",Geoffrey Chaucer,men
Human misery is too great for men to do without faith.,Heinrich Heine,men
"Italian men do appreciate beautiful women. They're not afraid of the beauty, which is nice.",Eva Herzigova,men
"Men may live fools, but fools they cannot die.",Edward Young,men
"There is always a type of man who says he loves his fellow men, and expects to make a living at it.",E. W. Howe,men
Men have as exaggerated an idea of their rights as women have of their wrongs.,E. W. Howe,men
Law describes the way things would work if men were angels.,Christopher Dawson,men
"A lot of times, women don't get the male perspective in regards to a relationship, what men go through when they're not really dealing well.",Morris Chestnut,men
Men are different. When they are in love they may also have other girlfriends.,Zhang Ziyi,men
"Where all men think alike, no one thinks very much.",Walter Lippmann,men
All men's gains are the fruit of venturing.,Herodotus,men
"All men have an instinct for conflict: at least, all healthy men.",Hilaire Belloc,men
"We should weep for men at their birth, not at their death.",Charles de Montesquieu,men
"I have 20,000 girlfriends, all around the world.",Justin Timberlake,men
"The beauty of a strong, lasting commitment is often best understood by men incapable of it.",Murray Kempton,men
"Commitment means that it is possible for a man to yield the nerve center of his consent to a purpose or cause, a movement or an ideal, which may be more important to him than whether he lives or dies.",Howard Thurman,men
Men are actually the weaker sex.,George Weinberg,men
"Either men will learn to live like brothers, or they will die like beasts.",Max Lerner,men
"Men, who are rogues individually, are in the mass very honorable people.",Charles de Secondat,men
No gentleman ever discusses any relationship with a lady.,Keith Miller,men
Women thrive on novelty and are easy meat for the commerce of fashion. Men prefer old pipes and torn jackets.,Anthony Burgess,men
Men are not against you they are merely for themselves.,Gene Fowler,men
Culture makes all men gentle.,Menander,men
"When a man is no longer anxious to do better than well, he is done for.",Benjamin Haydon,men
Truth sits upon the lips of dying men.,Matthew Arnold,men
"You can't keep changing men, so you settle for changing your lipstick.",Heather Locklear,men
Neutral men are the devil's allies.,Edwin Hubbel Chapin,men
"I think men are afraid to be with a successful woman, because we are terribly strong, we know what we want and we are not fragile enough.",Shirley Bassey,men
"Stronger by weakness, wiser men become.",Edmund Waller,men
"Whenever ideas fail, men invent words.",Martin H. Fischer,men
No nice men are good at getting taxis.,Katharine Whitehorn,men
Men are often biased in their judgment on account of their sympathy and their interests.,George William Norris,men
For most men life is a search for the proper manila envelope in which to get themselves filed.,Clifton Paul Fadiman,men
"That common cold of the male psyche, fear of commitment.",Richard Schickel,men
"We the people are the rightful masters of both Congress and the courts, not to overthrow the Constitution but to overthrow the men who pervert the Constitution.",Abraham Lincoln,men
Our scientific power has outrun our spiritual power. We have guided missiles and misguided men.,"Martin Luther King, Jr.",men
"Nearly all men can stand adversity, but if you want to test a man's character, give him power.",Abraham Lincoln,men
"A wise and frugal Government, which shall restrain men from injuring one another, which shall leave them otherwise free to regulate their own pursuits of industry and improvement, and shall not take from the mouth of labor the bread it has earned. This is the sum of good government, and this is necessary to close the circlue of our felicities.",Thomas Jefferson,men
"All men dream, but not equally. Those who dream by night in the dusty recesses of their minds, wake in the day to find that it was vanity: but the dreamers of the day are dangerous men, for they may act on their dreams with open eyes, to make them possible.",T. E. Lawrence,men
The only thing necessary for the triumph of evil is for good men to do nothing.,Edmund Burke,men
"All the world's a stage, and all the men and women merely players: they have their exits and their entrances and one man in his time plays many parts, his acts being seven ages.",William Shakespeare,men
"Rarely do we find men who willingly engage in hard, solid thinking. There is an almost universal quest for easy answers and half-baked solutions. Nothing pains some people more than having to think.","Martin Luther King, Jr.",men
A nation or civilization that continues to produce soft-minded men purchases its own spiritual death on the installment plan.,"Martin Luther King, Jr.",men
"Security is mostly a superstition. It does not exist in nature, nor do the children of men as a whole experience it. Avoiding danger is no safer in the long run than outright exposure. Life is either a daring adventure, or nothing.",Helen Keller,men
People sleep peaceably in their beds at night only because rough men stand ready to do violence on their behalf.,George Orwell,men
"Just as a candle cannot burn without fire, men cannot live without a spiritual life.",Buddha,men
Do not pray for easy lives. Pray to be stronger men.,John F. Kennedy,men
Wise men speak because they have something to say Fools because they have to say something.,Plato,men
"It is wonderful how much time good people spend fighting the devil. If they would only expend the same amount of energy loving their fellow men, the devil would die in his own tracks of ennui.",Helen Keller,men
The means by which we live have outdistanced the ends for which we live. Our scientific power has outrun our spiritual power. We have guided missiles and misguided men.,"Martin Luther King, Jr.",men
"Between men and women there is no friendship possible. There is passion, enmity, worship, love, but no friendship.",Oscar Wilde,men
We have guided missiles and misguided men.,"Martin Luther King, Jr.",men
Force always attracts men of low morality.,Albert Einstein,men
I do not believe in a fate that falls on men however they act but I do believe in a fate that falls on them unless they act.,Buddha,men
To sin by silence when they should protest makes cowards of men.,Abraham Lincoln,men
"If I am walking with two other men, each of them will serve as my teacher. I will pick out the good points of the one and imitate them, and the bad points of the other and correct them in myself.",Confucius,men
"Fourscore and seven years ago our fathers brought forth on this continent, a new nation, conceived in Liberty, and dedicated to the proposition that all men are created equal.",Abraham Lincoln,men
There are three kinds of men. The one that learns by reading. The few who learn by observation. The rest of them have to pee on the electric fence for themselves.,Will Rogers,men
"All men's souls are immortal, but the souls of the righteous are immortal and divine.",Socrates,men
"There is no hunting like the hunting of man, and those who have hunted armed men long enough and liked it, never care for anything else thereafter.",Ernest Hemingway,men
We can easily forgive a child who is afraid of the dark the real tragedy of life is when men are afraid of the light.,Plato,men
Within the covers of the Bible are the answers for all the problems men face.,Ronald Reagan,men
"Every man is said to have his peculiar ambition. Whether it be true or not, I can say for one that I have no other so great as that of being truly esteemed of my fellow men, by rendering myself worthy of their esteem.",Abraham Lincoln,men
"We hold these truths to be self-evident: that all men are created equal that they are endowed by their Creator with certain unalienable rights that among these are life, liberty, and the pursuit of happiness.",Thomas Jefferson,men
"There is a tide in the affairs of men, Which taken at the flood, leads on to fortune. Omitted, all the voyage of their life is bound in shallows and in miseries. On such a full sea are we now afloat. And we must take the current when it serves, or lose our ventures.",William Shakespeare,men
"Above all, we must realize that no arsenal, or no weapon in the arsenals of the world, is so formidable as the will and moral courage of free men and women. It is a weapon our adversaries in today's world do not have.",Ronald Reagan,men
Associate with men of good quality if you esteem your own reputation for it is better to be alone than in bad company.,George Washington,men
"The assertion that 'all men are created equal' was of no practical use in effecting our separation from Great Britain and it was placed in the Declaration not for that, but for future use.",Abraham Lincoln,men
"Our defense is in the preservation of the spirit which prizes liberty as a heritage of all men, in all lands, everywhere. Destroy this spirit and you have planted the seeds of despotism around your own doors.",Abraham Lincoln,men
"These men ask for just the same thing, fairness, and fairness only. This, so far as in my power, they, and all others, shall have.",Abraham Lincoln,men
I see when men love women. They give them but a little of their lives. But women when they love give everything.,Oscar Wilde,men
"Men occasionally stumble over the truth, but most of them pick themselves up and hurry off as if nothing had happened.",Winston Churchill,men
"Every creature is better alive than dead, men and moose and pine trees, and he who understands it aright will rather preserve its life than destroy it.",Henry David Thoreau,men
It has always been a mystery to me how men can feel themselves honoured by the humiliation of their fellow beings.,Mahatma Gandhi,men
"Democracy is when the indigent, and not the men of property, are the rulers.",Aristotle,men
The evil that men do lives after them the good is oft interred with their bones.,William Shakespeare,men
The time is near at hand which must determine whether Americans are to be free men or slaves.,George Washington,men
"Success or failure depends more upon attitude than upon capacity successful men act as though they have accomplished or are enjoying something. Soon it becomes a reality. Act, look, feel successful, conduct yourself accordingly, and you will be amazed at the positive results.",William James,men
Men are what their mothers made them.,Ralph Waldo Emerson,men
Many men go fishing all of their lives without knowing that it is not fish they are after.,Henry David Thoreau,men
"Women and cats will do as they please, and men and dogs should relax and get used to the idea.",Robert A. Heinlein,men
"Wisdom, compassion, and courage are the three universally recognized moral qualities of men.",Confucius,men
Timid men prefer the calm of despotism to the tempestuous sea of liberty.,Thomas Jefferson,men
"It has always seemed strange to me... the things we admire in men, kindness and generosity, openness, honesty, understanding and feeling, are the concomitants of failure in our system. And those traits we detest, sharpness, greed, acquisitiveness, meanness, egotism and self-interest, are the traits of success. And while men admire the quality of the first they love the produce of the second.",John Steinbeck,men
"The hours I spend with you I look upon as sort of a perfumed garden, a dim twilight, and a fountain singing to it. You and you alone make me feel that I am alive. Other men it is said have seen angels, but I have seen thee and thou art enough.",George Edward Moore,men
"Employ your time in improving yourself by other men's writings, so that you shall gain easily what others have labored hard for.",Socrates,men
"The important thing is that men should have a purpose in life. It should be something useful, something good.",Dalai Lama,men
"All successful people men and women are big dreamers. They imagine what their future could be, ideal in every respect, and then they work every day toward their distant vision, that goal or purpose.",Brian Tracy,men
"As far as I knew white women were never lonely, except in books. White men adored them, Black men desired them and Black women worked for them.",Maya Angelou,men
"As our enemies have found we can reason like men, so now let us show them we can fight like men also.",Thomas Jefferson,men
"Before success comes in any man's life, he's sure to meet with much temporary defeat and, perhaps some failures. When defeat overtakes a man, the easiest and the most logical thing to do is to quit. That's exactly what the majority of men do.",Napoleon Hill,men
"Men kick friendship around like a football, but it doesn't seem to crack. Women treat it like glass and it goes to pieces.",Anne Morrow Lindbergh,men
Women may fall when there's no strength in men.,William Shakespeare,men
What does love look like? It has the hands to help others. It has the feet to hasten to the poor and needy. It has eyes to see misery and want. It has the ears to hear the sighs and sorrows of men. That is what love looks like.,Saint Augustine,men
"It does not take a majority to prevail... but rather an irate, tireless minority, keen on setting brushfires of freedom in the minds of men.",Samuel Adams,men
"An association of men who will not quarrel with one another is a thing which has never yet existed, from the greatest confederacy of nations down to a town meeting or a vestry.",Thomas Jefferson,men
I have no fear that the result of our experiment will be that men may be trusted to govern themselves without a master.,Thomas Jefferson,men
"Books constitute capital. A library book lasts as long as a house, for hundreds of years. It is not, then, an article of mere consumption but fairly of capital, and often in the case of professional men, setting out in life, it is their only capital.",Thomas Jefferson,men
"A hero is born among a hundred, a wise man is found among a thousand, but an accomplished one might not be found even among a hundred thousand men.",Plato,men
"Men marry because they are tired women, because they are curious both are disappointed.",Oscar Wilde,men
Shallow men believe in luck. Strong men believe in cause and effect.,Ralph Waldo Emerson,men
"As I grow older, I pay less attention to what men say. I just watch what they do.",Andrew Carnegie,men
Battle is the most magnificent competition in which a human being can indulge. It brings out all that is best it removes all that is base. All men are afraid in battle. The coward is the one who lets his fear overcome his sense of duty. Duty is the essence of manhood.,George S. Patton,men
I have no ambition to govern men it is a painful and thankless office.,Thomas Jefferson,men
The marvel of all history is the patience with which men and women submit to burdens unnecessarily laid upon them by their governments.,George Washington,men
"Instead of comparing our lot with that of those who are more fortunate than we are, we should compare it with the lot of the great majority of our fellow men. It then appears that we are among the privileged.",Helen Keller,men
It takes time to persuade men to do even what is for their own good.,Thomas Jefferson,men
Men are so willing to respect anything that bores them.,Marilyn Monroe,men
"Fishes live in the sea, as men do a-land the great ones eat up the little ones.",William Shakespeare,men
"Jealousy is both reasonable and belongs to reasonable men, while envy is base and belongs to the base, for the one makes himself get good things by jealousy, while the other does not allow his neighbour to have them through envy.",Aristotle,men
Wise men don't need advice. Fools won't take it.,Benjamin Franklin,men
All men are prepared to accomplish the incredible if their ideals are threatened.,Maya Angelou,men
It is foolish and wrong to mourn the men who died. Rather we should thank God that such men lived.,George S. Patton,men
There is a natural aristocracy among men. The grounds of this are virtue and talents.,Thomas Jefferson,men
"Let me embrace thee, sour adversity, for wise men say it is the wisest course.",William Shakespeare,men
"Men are April when they woo, December when they wed. Maids are May when they are maids, but the sky changes when they are wives.",William Shakespeare,men
Sometimes I wonder if men and women really suit each other. Perhaps they should live next door and just visit now and then.,Katharine Hepburn,men
Only the wisest and stupidest of men never change.,Confucius,men
