"Let us not seek the Republican answer or the Democratic answer, but the right answer. Let us not seek to fix the blame for the past. Let us accept our own responsibility for the future.",John F. Kennedy,politics
"Suppose you were an idiot, and suppose you were a member of Congress but I repeat myself.",Mark Twain,politics
One of the penalties for refusing to participate in politics is that you end up being governed by your inferiors.,Plato,politics
"If you put the federal government in charge of the Sahara Desert, in 5 years there'd be a shortage of sand.",Milton Friedman,politics
It is enough that the people know there was an election. The people who cast the votes decide nothing. The people who count the votes decide everything.,Joseph Stalin,politics
"It is better to be violent, if there is violence in our hearts, than to put on the cloak of nonviolence to cover impotence.",Mahatma Gandhi,politics
"The modern conservative is engaged in one of man's oldest exercises in moral philosophy that is, the search for a superior moral justification for selfishness.",John Kenneth Galbraith,politics
"I am extraordinarily patient, provided I get my own way in the end.",Margaret Thatcher,politics
If you have ten thousand regulations you destroy all respect for the law.,Winston Churchill,politics
Healthy citizens are the greatest asset any country can have.,Winston Churchill,politics
"The whole aim of practical politics is to keep the populace alarmed (and hence clamorous to be led to safety) by menacing it with an endless series of hobgoblins, all of them imaginary.",H. L. Mencken,politics
"Democracy is when the indigent, and not the men of property, are the rulers.",Aristotle,politics
Politics is not a game. It is an earnest business.,Winston Churchill,politics
"Whenever a man has cast a longing eye on offices, a rottenness begins in his conduct.",Thomas Jefferson,politics
"The good news is that, according to the Obama administration, the rich will pay for everything. The bad news is that, according to the Obama administration, you're rich.",P. J. O'Rourke,politics
Principles have no real force except when one is well-fed.,Mark Twain,politics
"A conservative is a man with two perfectly good legs who, however, has never learned how to walk forward.",Franklin D. Roosevelt,politics
"If voting changed anything, they'd make it illegal.",Emma Goldman,politics
"If you have always believed that everyone should play by the same rules and be judged by the same standards, that would have gotten you labeled a radical 60 years ago, a liberal 30 years ago and a racist today.",Thomas Sowell,politics
"If the United States of America or Britain is having elections, they don't ask for observers from Africa or from Asia. But when we have elections, they want observers.",Nelson Mandela,politics
"Always vote for principle, though you may vote alone, and you may cherish the sweetest reflection that your vote is never lost.",John Quincy Adams,politics
A fool and his money are soon elected.,Will Rogers,politics
"In this world of sin and sorrow there is always something to be thankful for as for me, I rejoice that I am not a Republican.",H. L. Mencken,politics
I have no ambition to govern men it is a painful and thankless office.,Thomas Jefferson,politics
Politics have no relation to morals.,Niccolo Machiavelli,politics
Those who stand for nothing fall for anything.,Alexander Hamilton,politics
Perseverance is the hard work you do after you get tired of doing the hard work you already did.,Newt Gingrich,politics
"If we don't believe in freedom of expression for people we despise, we don't believe in it at all.",Noam Chomsky,politics
"The Democrats are the party that says government will make you smarter, taller, richer, and remove the crabgrass on your lawn. The Republicans are the party that says government doesn't work and then they get elected and prove it.",P. J. O'Rourke,politics
"Inflation is as violent as a mugger, as frightening as an armed robber and as deadly as a hit man.",Ronald Reagan,politics
My brother Bob doesn't want to be in government - he promised Dad he'd go straight.,John F. Kennedy,politics
The darkest places in hell are reserved for those who maintain their neutrality in times of moral crisis.,Dante Alighieri,politics
Politics has become so expensive that it takes a lot of money even to be defeated.,Will Rogers,politics
Life without liberty is like a body without spirit.,Khalil Gibran,politics
"Politicians also have no leisure, because they are always aiming at something beyond political life itself, power and glory, or happiness.",Aristotle,politics
I don't make jokes. I just watch the government and report the facts.,Will Rogers,politics
"A free America... means just this: individual freedom for all, rich or poor, or else this system of government we call democracy is only an expedient to enslave man to the machine and make him like it.",Frank Lloyd Wright,politics
"Only government can take perfectly good paper, cover it with perfectly good ink and make the combination worthless.",Milton Friedman,politics
"Hell, I never vote for anybody, I always vote against.",W. C. Fields,politics
"A healthy democracy requires a decent society it requires that we are honorable, generous, tolerant and respectful.",Charles W. Pickering,politics
"I have been thinking that I would make a proposition to my Republican friends... that if they will stop telling lies about the Democrats, we will stop telling the truth about them.",Adlai E. Stevenson,politics
"A leader in the Democratic Party is a boss, in the Republican Party he is a leader.",Harry S. Truman,politics
Politics: A strife of interests masquerading as a contest of principles. The conduct of public affairs for private advantage.,Ambrose Bierce,politics
There ain't no answer. There ain't gonna be any answer. There never has been an answer. That's the answer.,Gertrude Stein,politics
"Conservatism has had from its inception vigorously positive, intellectually rigorous agenda and thinking. That agenda should have in my three pillars: strengthen the economy, strengthen our security, and strengthen our families.",Mitt Romney,politics
"Conservative, n: A statesman who is enamored of existing evils, as distinguished from the Liberal who wishes to replace them with others.",Ambrose Bierce,politics
"Whenever men take the law into their own hands, the loser is the law. And when the law loses, freedom languishes.",Robert Kennedy,politics
We would all like to vote for the best man but he is never a candidate.,Kin Hubbard,politics
"When bad men combine, the good must associate else they will fall one by one, an unpitied sacrifice in a contemptible struggle.",Edmund Burke,politics
Ninety percent of the politicians give the other ten percent a bad reputation.,Henry A. Kissinger,politics
"A liberal is a man or a woman or a child who looks forward to a better day, a more tranquil night, and a bright, infinite future.",Leonard Bernstein,politics
"Any American who is prepared to run for president should automatically, by definition, be disqualified from ever doing so.",Gore Vidal,politics
Bad politicians are sent to Washington by good people who don't vote.,William E. Simon,politics
We hang the petty thieves and appoint the great ones to public office.,Aesop,politics
"I love power. But it is as an artist that I love it. I love it as a musician loves his violin, to draw out its sounds and chords and harmonies.",Napoleon Bonaparte,politics
In politics the middle way is none at all.,John Adams,politics
You want a friend in Washington? Get a dog.,Harry S. Truman,politics
"The successful revolutionary is a statesman, the unsuccessful one a criminal.",Erich Fromm,politics
"Conservatives are not necessarily stupid, but most stupid people are conservatives.",John Stuart Mill,politics
"Instead of giving a politician the keys to the city, it might be better to change the locks.",Doug Larson,politics
"Tradition means giving votes to the most obscure of all classes, our ancestors. It is the democracy of the dead. Tradition refuses to submit to that arrogant oligarchy who merely happen to be walking around.",Gilbert K. Chesterton,politics
"There are many men of principle in both parties in America, but there is no party of principle.",Alexis de Tocqueville,politics
"All the president is, is a glorified public relations man who spends his time flattering, kissing, and kicking people to get them to do what they are supposed to do anyway.",Harry S. Truman,politics
A diplomat is a person who can tell you to go to hell in such a way that you actually look forward to the trip.,Caskie Stinnett,politics
"The person who has nothing for which he is willing to fight, nothing which is more important than his own personal safety, is a miserable creature and has no chance of being free unless made and kept so by the exertions of better men than himself.",John Stuart Mill,politics
"'Tis the business of little minds to shrink but he whose heart is firm, and whose conscience approves his conduct, will pursue his principles unto death.",Thomas Paine,politics
"When buying and selling are controlled by legislation, the first things to be bought and sold are legislators.",P. J. O'Rourke,politics
He who knows how to flatter also knows how to slander.,Napoleon Bonaparte,politics
I would remind you that extremism in the defense of liberty is no vice! And let me remind you also that moderation in the pursuit of justice is no virtue.,Barry Goldwater,politics
"Apparently, a democracy is a place where numerous elections are held at great cost without issues and with interchangeable candidates.",Gore Vidal,politics
"Politics, it seems to me, for years, or all too long, has been concerned with right or left instead of right or wrong.",Richard Armour,politics
Half of the American people have never read a newspaper. Half never voted for President. One hopes it is the same half.,Gore Vidal,politics
"Radical changes in world politics leave America with a heightened responsibility to be, for the world, an example of a genuinely free, democratic, just and humane society.",Pope John Paul II,politics
Hell hath no fury like a bureaucrat scorned.,Milton Friedman,politics
An idea not coupled with action will never get any bigger than the brain cell it occupied.,Arnold H. Glasow,politics
Power tends to corrupt and absolute power corrupts absolutely.,Lord Acton,politics
"Republicans are men of narrow vision, who are afraid of the future.",Jimmy Carter,politics
Pollution is nothing but the resources we are not harvesting. We allow them to disperse because we've been ignorant of their value.,R. Buckminster Fuller,politics
It is not in the nature of politics that the best men should be elected. The best men do not want to govern their fellowmen.,George MacDonald,politics
"Oh, that lovely title, ex-president.",Dwight D. Eisenhower,politics
Democracy is being allowed to vote for the candidate you dislike least.,Robert Byrne,politics
A liberal is a man who is willing to spend somebody else's money.,Carter Glass,politics
One of the reasons people hate politics is that truth is rarely a politician's objective. Election and power are.,Cal Thomas,politics
Republicans have nothing but bad ideas and Democrats have no ideas.,Lewis Black,politics
In politics nothing is contemptible.,Benjamin Disraeli,politics
"In most places in the country, voting is looked upon as a right and a duty, but in Chicago it's a sport.",Dick Gregory,politics
"If we desire respect for the law, we must first make the law respectable.",Louis D. Brandeis,politics
"I know many writers who first dictate passages, then polish what they have dictated. I speak, then I polish - occasionally I do windows.",Edward Koch,politics
When I was a boy I was told that anybody could become President I'm beginning to believe it.,Clarence Darrow,politics
America's present need is not heroics but healing not nostrums but normalcy not revolution but restoration.,Warren G. Harding,politics
The activist is not the man who says the river is dirty. The activist is the man who cleans up the river.,Ross Perot,politics
Our whole constitutional heritage rebels at the thought of giving government the power to control men's minds.,Thurgood Marshall,politics
For every talent that poverty has stimulated it has blighted a hundred.,John W. Gardner,politics
"You may think the president is all-powerful, but he is not. He needs a lot of guidance from the Lord.",Barbara Bush,politics
Politics is the art of choosing between the disastrous and the unpalatable.,John Kenneth Galbraith,politics
You cannot spend your way out of recession or borrow your way out of debt.,Daniel Hannan,politics
"Liberalism is, I think, resurgent. One reason is that more and more people are so painfully aware of the alternative.",John Kenneth Galbraith,politics
"In order to become the master, the politician poses as the servant.",Charles de Gaulle,politics
"When one may pay out over two million dollars to presidential and Congressional campaigns, the U.S. government is virtually up for sale.",John W. Gardner,politics
"A conservative is a man who just sits and thinks, mostly sits.",Woodrow Wilson,politics
The end move in politics is always to pick up a gun.,R. Buckminster Fuller,politics
Do you ever get the feeling that the only reason we have elections is to find out if the polls were right?,Robert Orben,politics
"I have long enjoyed the friendship and companionship of Republicans because I am by instinct a teacher, and I would like to teach them something.",Woodrow Wilson,politics
Every man who repeats the dogma of Mill that one country is no fit to rule another country must admit that one class is not fit to rule another class.,B. R. Ambedkar,politics
"If nominated, I will not run if elected, I will not serve.",William Tecumseh Sherman,politics
"The idea that you can merchandise candidates for high office like breakfast cereal - that you can gather votes like box tops - is, I think, the ultimate indignity to the democratic process.",Adlai E. Stevenson,politics
Liberalism is trust of the people tempered by prudence. Conservatism is distrust of the people tempered by fear.,William E. Gladstone,politics
A politician will do anything to keep his job - even become a patriot.,William Randolph,politics
"If you don't like the President, it costs you 90 bucks to fly to Washington to picket. If you don't like the Governor, it costs you 60 bucks to fly to Albany to picket. If you don't like me, 90 cents.",Edward Koch,politics
The secret of getting things done is to act!,Dante Alighieri,politics
A conservative is someone who makes no changes and consults his grandmother when in doubt.,Woodrow Wilson,politics
Democracy is the recurrent suspicion that more than half of the people are right more than half of the time.,E. B. White,politics
Freedom of the press is guaranteed only to those who own one.,A. J. Liebling,politics
"The only difference between the Democrats and the Republicans is that the Democrats allow the poor to be corrupt, too.",Oscar Levant,politics
"Free speech is not to be regulated like diseased cattle and impure butter. The audience that hissed yesterday may applaud today, even for the same performance.",William O. Douglas,politics
"As you make your bed, so you must lie in it.",Daniel J. Boorstin,politics
I think it's a terrible shame that politics has become show business.,Sydney Pollack,politics
I have a fantasy where Ted Turner is elected President but refuses because he doesn't want to give up power.,Arthur C. Clarke,politics
Vote for the man who promises least he'll be the least disappointing.,Bernard Baruch,politics
"Politics is war without bloodshed, while war is politics with bloodshed.",Mao Zedong,politics
No real social change has ever been brought about without a revolution... revolution is but thought carried into action.,Emma Goldman,politics
Politics is too serious a matter to be left to the politicians.,Charles de Gaulle,politics
A war for a great principle ennobles a nation.,Albert Pike,politics
The revolution is a dictatorship of the exploited against the exploiters.,Fidel Castro,politics
"Turn on to politics, or politics will turn on you.",Ralph Nader,politics
Every politician should have been born an orphan and remain a bachelor.,Lady Bird Johnson,politics
Many politicians are in the habit of laying it down as a self-evident proposition that no people ought to be free till they are fit to use their freedom. The maxim is worthy of the fool in the old story who resolved not to go into the water till he had learned to swim.,Thomas B. Macaulay,politics
The flood of money that gushes into politics today is a pollution of democracy.,Theodore White,politics
Freedom means the opportunity to be what we never thought we would be.,Daniel J. Boorstin,politics
"The revenues of Cuban state-run companies are used exclusively for the benefit of the people, to whom they belong.",Fidel Castro,politics
Reporters thrive on the world's misfortune. For this reason they often take an indecent pleasure in events that dismay the rest of humanity.,Russell Baker,politics
The world is governed by opinion.,William Ellery Channing,politics
"The beef industry has contributed to more American deaths than all the wars of this century, all natural disasters, and all automobile accidents combined.",Neal Barnard,politics
A conservative is one who admires radicals centuries after they're dead.,Leo Rosten,politics
The most important political office is that of the private citizen.,Louis D. Brandeis,politics
In politics it is necessary either to betray one's country or the electorate. I prefer to betray the electorate.,Charles de Gaulle,politics
I do have a political agenda. It's to have as few regulations as possible.,Dan Quayle,politics
The thing I enjoyed most were visits from children. They did not want public office.,Herbert Hoover,politics
"Justice, sir, is the great interest of man on earth. It is the ligament which holds civilized beings and civilized nations together.",Daniel Webster,politics
It is a measure of the framers' fear that a passing majority might find it expedient to compromise 4th Amendment values that these values were embodied in the Constitution itself.,Sandra Day O'Connor,politics
"If you are going to sin, sin against God, not the bureaucracy. God will forgive you but the bureaucracy won't.",Hyman Rickover,politics
Conservatives define themselves in terms of what they oppose.,George Will,politics
I should prefer to have a politician who regularly went to a massage parlour than one who promised a laptop computer for every teacher.,A. N. Wilson,politics
"The largest party in America, by the way, is neither the Democrats nor the Republicans. It's the party of non-voters.",Robert Reich,politics
"In politics, what begins in fear usually ends in failure.",Samuel Taylor Coleridge,politics
I can remember when Democrats believed that it was the duty of America to fight for freedom over tyranny.,Zell Miller,politics
You have not converted a man because you have silenced him.,John Morley,politics
The first resistance to social change is to say it's not necessary.,Gloria Steinem,politics
"The Vice-Presidency is sort of like the last cookie on the plate. Everybody insists he won't take it, but somebody always does.",Bill Vaughan,politics
"Voters don't decide issues, they decide who will decide issues.",George Will,politics
"The world will never have lasting peace so long as men reserve for war the finest human qualities. Peace, no less than war, requires idealism and self-sacrifice and a righteous and dynamic faith.",John Foster Dulles,politics
"The politicians were talking themselves red, white and blue in the face.",Clare Boothe Luce,politics
"When they see me holding fish, they can see that I am comfortable with kings as well as with paupers.",Imelda Marcos,politics
"The United States brags about its political system, but the President says one thing during the election, something else when he takes office, something else at midterm and something else when he leaves.",Deng Xiaoping,politics
"I've been to war, and it's not easy to kill. It's bloody and messy and totally horrifying, and the consequences are serious.",Oliver Stone,politics
"My hope is that 10 years from now, after I've been across the street at work for a while, they'll all be glad they gave me that wonderful vote.",Sandra Day O'Connor,politics
"It is difficult to discern a serious threat to religious liberty from a room of silent, thoughtful schoolchildren.",Sandra Day O'Connor,politics
Sensible and responsible women do not want to vote. The relative positions to be assumed by man and woman in the working out of our civilization were assigned long ago by a higher intelligence than ours.,Grover Cleveland,politics
He too serves a certain purpose who only stands and cheers.,Henry Adams,politics
"The more I see of the representatives of the people, the more I admire my dogs.",Alphonse de Lamartine,politics
"So long as we have enough people in this country willing to fight for their rights, we'll be called a democracy.",Roger Nash Baldwin,politics
"Confronted with the choice, the American people would choose the policeman's truncheon over the anarchist's bomb.",Spiro T. Agnew,politics
They say women talk too much. If you have worked in Congress you know that the filibuster was invented by men.,Clare Boothe Luce,politics
"When governments become large, voters cannot exercise close oversight, otherwise known as political power.",Maggie Gallagher,politics
Voting is a civic sacrament.,Theodore Hesburgh,politics
"In a democracy, dissent is an act of faith.",J. William Fulbright,politics
I was a woman in a man's world. I was a Democrat in a Republican administration. I was an intellectual in a world of bureaucrats. I talked differently. This may have made me a bit like an ink blot.,Jeane Kirkpatrick,politics
"Their very conservatism is secondhand, and they don't know what they are conserving.",Robertson Davies,politics
"When the body of the people is possessed of the supreme power, it is called a democracy.",Charles de Secondat,politics
"Your every voter, as surely as your chief magistrate, exercises a public trust.",Grover Cleveland,politics
It is our experience that political leaders do not always mean the opposite of what they say.,Abba Eban,politics
"And after I make a lot of money, I'll be able to afford running for office.",Christy Romano,politics
"I always voted at my party's call, and I never thought of thinking for myself at all.",William Gilbert,politics
I can't let important policy decisions hinge on the fact that an election is coming up every 90 days.,Gerhard Schroder,politics
What politicians want to create is irreversible change because when you leave office someone changes it back again.,Estelle Morris,politics
"We have, I fear, confused power with greatness.",Stewart Udall,politics
"Frankly, I don't mind not being President. I just mind that someone else is.",Edward Kennedy,politics
I think there is one higher office than president and I would call that patriot.,Gary Hart,politics
"If a politician murders his mother, the first response of the press or of his opponents will likely be not that it was a terrible thing to do, but rather that in a statement made six years before he had gone on record as being opposed to matricide.",Meg Greenfield,politics
We live in a world in which politics has replaced philosophy.,Martin L. Gross,politics
You better take advantage of the good cigars. You don't get much else in that job.,Thomas P. O'Neill,politics
"After much prayerful consideration, I feel that I must say I have climbed my last political mountain.",George C. Wallace,politics
"Our party is a diverse one, as is my home state of Illinois.",Dick Durbin,politics
You know they say the most dangerous person of the world is a member of the United States Congress just home from a three-day fact-finding trip.,Johnny Isakson,politics
It has been well said that a hungry man is more interested in four sandwiches than four freedoms.,"Henry Cabot Lodge, Jr.",politics
Television is democracy at its ugliest.,Paddy Chayefsky,politics
"I never considered a difference of opinion in politics, in religion, in philosophy, as cause for withdrawing from a friend.",Thomas Jefferson,politics
"Politics is the art of looking for trouble, finding it everywhere, diagnosing it incorrectly and applying the wrong remedies.",Groucho Marx,politics
"Politics is for the present, but an equation is for eternity.",Albert Einstein,politics
It has been said that politics is the second oldest profession. I have learned that it bears a striking resemblance to the first.,Ronald Reagan,politics
"I was losing interest in politics, when the repeal of the Missouri Compromise aroused me again. What I have done since then is pretty well known.",Abraham Lincoln,politics
"Politics is the ability to foretell what is going to happen tomorrow, next week, next month and next year. And to have the ability afterwards to explain why it didn't happen.",Winston Churchill,politics
"Politics is almost as exciting as war, and quite as dangerous. In war you can only be killed once, but in politics many times.",Winston Churchill,politics
"In war, you can only be killed once, but in politics, many times.",Winston Churchill,politics
I am never going to have anything more to do with politics or politicians. When this war is over I shall confine myself entirely to writing and painting.,Winston Churchill,politics
Politics are very much like war. We may even have to use poison gas at times.,Winston Churchill,politics
Those who say religion has nothing to do with politics do not know what religion is.,Mahatma Gandhi,politics
"In politics, nothing happens by accident. If it happens, you can bet it was planned that way.",Franklin D. Roosevelt,politics
