"Politics, as a practise, whatever its professions, has always been the systematic organization of hatreds.",Henry Adams,politics
Politics... have always been the systematic organization of hatreds.,Henry Adams,politics
"Skip the religion and politics, head straight to the compassion. Everything else is a distraction.",Talib Kweli,politics
"I believe people who go into politics want to do the right thing. And then they hit a big wall of re-election and the pettiness of politics. In the end, politics gets in the way of the business of people.",Kevin Costner,politics
"The lesson of the last year is this: foreign policy can't be managed through the politics of personality, and our President would do well to take note of an observation John F. Kennedy made once he was in office - that all of the world's problems aren't his predecessor's fault.",Sarah Palin,politics
"In politics there are some candidates who use change to promote their careers, and then there are those like John McCain who use their careers to promote change.",Sarah Palin,politics
I'm not the guy to ask about politics. I'm a gag writer.,David Mamet,politics
"Frankly, if you do politics, you should not be thinking about your dignity.",Aung San Suu Kyi,politics
"We read too much Shakespeare at school, and view our parliamentary politics as dynastic drama, in which an impatient crown prince frets at his long subordination and begins to scheme for the throne he knows he merits, was promised and has earned.",James Buchan,politics
"Except for politics, no business is scrutinized more exhaustively than journalism.",Russell Baker,politics
"In politics, the people I most despise are those who have no values.",Diane Abbott,politics
I try not to spend too much time on partisan politics. Life's too short for that. I don't really believe that there have been many human problems solved by politics.,Dean Koontz,politics
I got politics and economics moving and then others took over.,Lech Walesa,politics
Politics is a blood sport.,Aneurin Bevan,politics
"Love is blind. My politics has been, too. I think you can fall in love with ideas, and you can fall in love with people. It's a very subjective experience. And I'm loyal to that experience.",Robert Wyatt,politics
"My shows aren't about trying to save some place, because I don't feel that's the right venue for it. That's my politics right there: Don't bring politics to my shows.",Kid Rock,politics
"You know, I'm just not going to get into American politics.",Benjamin Netanyahu,politics
I will say that I think Israel enjoys strong bipartisan support in the United States. It's really above and beyond American politics.,Benjamin Netanyahu,politics
"It's time to let science and medicine, not politics and rhetoric, lead us to good, sound policy.",Eliot Spitzer,politics
"Sometimes in politics, you think you've seen it all. Turns out I was wrong.",Eliot Spitzer,politics
A year is an eternity in politics - though less than a moment in history.,Eliot Spitzer,politics
In politics you learn to always smile.,Eliot Spitzer,politics
I do not believe that politics in the long run is about individuals. It is about ideas.,Eliot Spitzer,politics
"In the melting pot that is America, inclusive trumps exclusive. Whether it's single women, young adults, or minorities, alienating the rapidly growing voting blocs is not smart politics.",Eliot Spitzer,politics
"I think President Obama could have handled politics and policies differently. But he has been decisive, strong, and consistent - important qualities in a president. Mitt Romney is indeed an Etch A Sketch, the antithesis of leadership.",Eliot Spitzer,politics
Why does it have to be politics? Is there a dynamism to that world and a theoretical capacity to do things that draws many talented people? Absolutely. Are there other ways to be involved and lead an interesting life? Of course.,Eliot Spitzer,politics
"Yet, it ought to be obvious that good music generally occupies a higher plane that mere politics. Great writers can express moods through melody and capture experiences we share most powerfully - love, lust, longing joy, rage, fear triumph, yearning and confusion.",Tony Snow,politics
"The science of politics is the one science that is deposited by the streams of history, like the grains of gold in the sand of a river and the knowledge of the past, the record of truths revealed by experience, is eminently practical, as an instrument of action and a power that goes to making the future.",Lord Acton,politics
Good policy makes good politics and what I've done has been good politics.,J. C. Watts,politics
I never got into politics for it to be a career.,J. C. Watts,politics
I never got into politics for it to be a career. It doesn't take a lot of strength to hang on. It takes a lot of strength to let go.,J. C. Watts,politics
"I guess probably in my time in politics, it continued to be affirmed to me that the African-American community, despite being subscription television's most valuable customers, they are very underserved by cable and satellite television programming options.",J. C. Watts,politics
"I'm not driven to get back into politics. It's not on my top five things to do before I die, but saying that, I may be in politics in the next year or the next ten years. I've been on the front line for 12 years, four in state government, eight on the national level.",J. C. Watts,politics
"We need to remember that politics is all about people, not programs. We shouldn't want to take the humanness out of the political arena.",J. C. Watts,politics
Growing up in politics I know that women decide all elections because we do all the work.,Caroline Kennedy,politics
Politics is not an exact science.,Otto von Bismarck,politics
"Most people don't want to talk about politics and religion. They say, 'Let's talk about something else.'",Prince,politics
I don't believe your soul mate has to share your politics.,Rachel Weisz,politics
I don't like to talk about things where you're going to gt one side or the other unhappy. My music has no politics.,Loretta Lynn,politics
"Those who write the editorials and those who write the columns, they simply are unaccountable. They're free to impose their cultural politics in the name of freedom of the press.",Jesse Jackson,politics
"It's not that I'm universally loved. We know I'm not in New Jersey. But what they do say in New Jersey is, 'We like him, and we think he's telling us the truth.' I think we need to have that type of politics on the national level.",Chris Christie,politics
"I want to stay away from politics, or else I'll probably end up putting my size fifteen foot into my mouth.",Peter Steele,politics
"For a person who promised hope and civility in politics, Mr. Obama has shown a borderline obsessiveness in blaming Mr. Bush.",Karl Rove,politics
"You realize that for all the shenanigans that go on in the big circus of politics, everybody wakes up and goes to work.",Lewis Black,politics
Politics has less to do with where you live than where your heart is.,Margaret Cho,politics
"I was in elective politics for 24 years. I've made four national races, two for President, two for Vice President. I have found there are other ways to serve, and I'm enjoying them.",Al Gore,politics
"One of the big changes in politics has been because families, individuals, have felt worried, insecure... worried about the economy, worried about their jobs, worried about their kids' futures... actually the disconnect between the public and media discourse and people's everyday concerns has become bigger not smaller.",Nick Clegg,politics
"We live in a stage of politics, where legislators seem to regard the passage of laws as much more important than the results of their enforcement.",William Howard Taft,politics
"For too long, we have focused on our differences - in our politics and backgrounds, in our race and beliefs - rather than cherishing the unity and pride that binds us together.",Bob Riley,politics
"You can study government and politics in school, but the best way to really understand the process is to volunteer your time.",Rob McKenna,politics
We are losing sight of civility in government and politics. Debate and dialogue is taking a back seat to the politics of destruction and anger and control. Dogma has replaced thoughtful discussion between people of differing views.,James McGreevey,politics
"While everyone else is thinking about economics and politics, executive salaries and the future of the euro, do the opposite, even if it's hard. Invest in the spirit.",Jonathan Sacks,politics
I don't like politics.,will.i.am,politics
"Politics are about preserving relationships at the end of the day, and it has nothing to do with the greater good for humanity. It's just all about business.",will.i.am,politics
"You can rule ignorance you can manipulate the illiterate you can do whatever you want when a people are uneducated, so that goes in line with corrupt business and corrupt politics.",will.i.am,politics
"Sincerity and competence is a strong combination. In politics, it is everything.",Peggy Noonan,politics
"George Clooney's 'Ides of March' could be the most under-appreciated movie of the year. In 20 years they're gonna go back and say, 'Oh, that was American politics in that time period.' I follow politics, I love it, and that movie is so authentic.",Harvey Weinstein,politics
I... grew up in politics and I used to work for the Democratic Party.,Harvey Weinstein,politics
"Some of the FDA's own scientists have charged that politics, not science, is behind the FDA's actions.",Joseph Crowley,politics
"Community organizing is all about building grassroots support. It's about identifying the people around you with whom you can create a common, passionate cause. And it's about ignoring the conventional wisdom of company politics and instead playing the game by very different rules.",Tom Peters,politics
I didn't know my Dad - he moved out early. And my mom's politics were kind of hardscrabble. She didn't think about Democrats or Republicans. She thought about who made sense. I've been both in my life.,Dennis Miller,politics
No one out there is interested in who did what to whom in Westminster politics.,Iain Duncan Smith,politics
"The more that I know of politics, the more it makes me realize that being a politician is largely useless.",Sophia Bush,politics
In politics people build whole reputations off of getting one thing right.,Nate Silver,politics
"First of all, I think it's odd that people who cover politics wouldn't have any political views.",Nate Silver,politics
"I was looking for something like baseball, where there's a lot of data and the competition was pretty low. That's when I discovered politics.",Nate Silver,politics
"I guess I don't like the people in politics very much, to be blunt.",Nate Silver,politics
I've had an interest in politics since I was a little kid.,Rand Paul,politics
You don't go into politics unless you want to win.,Rand Paul,politics
"I cry, sometimes, because I'm not 20 years younger, and I'm not healthy. But if I were, I would even sacrifice my writing to enter politics.",Oriana Fallaci,politics
"I don't want to express my opinion about actual politics, because if I do, I have to be responsible for my decision.",Haruki Murakami,politics
I understand the process of politics and the game of television.,John Sununu,politics
The precise point at which a tax deduction becomes a 'loophole' or a tax incentive becomes a 'subsidy for special interests' is one of the great mysteries of politics.,John Sununu,politics
"Politics thrives on simple, clean messages, something that played to Obama's advantage in 2008. Stagnant unemployment and the loss of America's AAA rating are as simple and tough as they come. This is the economy on Obama's watch, and there's no one left to blame.",John Sununu,politics
"Like Indiana Jones, I don't like snakes - though that might lead some to ask why I'm in politics.",Theresa May,politics
"A lot of men in politics suddenly woke up to the issue of women in politics when they realised: hey, there are votes in this!",Theresa May,politics
I was in the Commons recently and saw a young lady wearing a nice pair of shoes. I said I liked them and she said my shoes were the reason she became involved in politics.,Theresa May,politics
It's called political economy because it is has nothing to do with either politics or economy.,Stephen Leacock,politics
"As long as I don't write about the government, religion, politics, and other institutions, I am free to print anything.",Pierre Beaumarchais,politics
I think that politics needs a bit of spicing up.,Nigel Farage,politics
"It's much easier to wear a Chairman Mao button and shake your fists in the air and all that, then to actually read the Communist manifesto and things like that and actually become involved in politics.",Lester Bangs,politics
I deliberately did not read anything about the Vietnam War because I felt the politics of the war eclipsed what happened to the veterans. The politics were irrelevant to what this memorial was.,Maya Lin,politics
Politics is the reflex of the business and industrial world.,Emma Goldman,politics
"There is no hope even that woman, with her right to vote, will ever purify politics.",Emma Goldman,politics
I still love following and thinking about politics. I enjoy recommending important journalism I read or see from other sources.,Dan Rather,politics
"If American politics are too dirty for women to take part in, there's something wrong with American politics.",Edna Ferber,politics
There is too much at stake for us to surrender to the politics of polarization.,Brad Henry,politics
In general people feel more relaxed about participating in politics. They aren't frightened as they used to be.,Aung San Suu Kyi,politics
"In politics, you also have to be cautiously optimistic.",Aung San Suu Kyi,politics
"We tend to think of politics as bad, full of dirty tricks, negative ads, big campaigns, but I am here to explore the original meaning of politics, which is positive and has to do with balancing competing interests and looking for solutions.",Eric Liu,politics
"I'm in politics. I'm in government, so nothing surprises me.",Andrew Cuomo,politics
"People go into politics because they want the affirmation, and they want the applause.",Andrew Cuomo,politics
"If I weren't doing the politics, I wouldn't be doing my job.",Andrew Cuomo,politics
Very few people go into politics to be reviled.,Andrew Cuomo,politics
"Once you start saying, 'Let's talk political, my own politics, my own aspirations,' it can become not just distracting in that it takes time, but it can become confusing and frustrating, and is this now a political agenda or a governmental agenda.",Andrew Cuomo,politics
I didn't run for student council president. I don't see myself in any way in elected office. I love policy. I'm not particularly fond of politics.,Condoleezza Rice,politics
"Public life is regarded as the crown of a career, and to young men it is the worthiest ambition. Politics is still the greatest and the most honorable adventure.",Pat Riley,politics
Mixing humor and politics is something that works.,Bryan Cranston,politics
"Whatever your supposed politics are - left, right - if you put it in a human connection, most people will rise to the occasion and feel the human pain in a way that they might not if it was presented in a more conceptual way.",George Saunders,politics
"There's a tradition in British intellectual life of mocking any non-political force that gets involved in politics, especially within the sphere of the arts and the theatre.",Harold Pinter,politics
"It's a good question, because a movie isn't good or bad based on its politics. It's usually good or bad for other reasons, though you might agree or disagree with its politics.",Roger Ebert,politics
"Well, you know what, I'm 60 years old, and I've been interested in politics since I was on my daddy's knee. During the 1948 election, we were praying for Truman. I know a lot about politics.",Roger Ebert,politics
"Let's just do what is right for the American people. And those of us who are involved in politics and government know that our responsibility is to the American people, that we have a responsibility to find our common ground, to seek it and to find it.",Nancy Pelosi,politics
"If I cry, it's about the personal loss of a friend or something like that. But when it comes to politics - no, I don't cry.",Nancy Pelosi,politics
"It's about time we make the well-being of our young people more important than ideology and politics. As a country, we benefit from investing in their future by investing in teen pregnancy prevention.",Jane Fonda,politics
"When I started 'CNN,' I made the decision to stay out of endorsing candidates, and let the doers make up their own minds about politics, that it wasn't going to come from me.",Ted Turner,politics
I don't know if anybody wants to mix their politics with their entertainment.,Fiona Apple,politics
"Yes, politics IS war without bloodshed and war is an extension of those politics.",H. Rap Brown,politics
The ability of the 1 percent to buy politicians and regulators is nothing new in American politics - just as inequality has been a permanent part of our economic system. This is true of virtually all political and economic systems.,Eric Alterman,politics
I'm highly political. I spend an awful lot of time in the U.S. trying to influence decision-makers. But I don't feel in tune with British politics.,Jane Goodall,politics
The problem of the Middle East is poverty more than politics.,Shimon Peres,politics
It's not about division. It's not about politics. My concern is how do we come together?,LeVar Burton,politics
"Well, purity - there's no purity in politics.",Jim DeMint,politics
Going into politics is something people have asked me about forever.,Caroline Kennedy,politics
"Well there's nobody who has a more supportive husband than I do, and he has a business that he runs, and it's his own business, so he has work to do, my kids have school to do, I mean, people have - there are other things in life besides politics.",Caroline Kennedy,politics
"Well, the role of money in politics is pretty corrupting right now.",Caroline Kennedy,politics
"You know, rock stardom... I have a hard time discussing that because I don't really accept it. It's not really that tangible. What's really bizarre is how it's used as a thing - you know, 'He's the rock star of politics,' 'He's the rock star of quarterbacks' - like it's the greatest thing in the world.",Eddie Vedder,politics
"I am a part of the political process whether the multinational forces are present or not. Politics is serving the people, not chairs and positions.",Muqtada al Sadr,politics
Politics is the art of the next best.,Otto von Bismarck,politics
Politics ruins the character.,Otto von Bismarck,politics
Politics is the art of the possible.,Otto von Bismarck,politics
"Today, I think the attitude is that governing is not necessarily good politics, and the result is that it's much more partisan and much more divided.",Leon Panetta,politics
There can only be democracy when money is not allowed to be spent in Politics.,Imran Khan,politics
But I don't need to use politics as a way of making money.,Imran Khan,politics
When I came into politics I always thought there was a possibility I would be killed.,Imran Khan,politics
"If there is one eternal truth of politics, it is that there are always a dozen good reasons for doing nothing.",John le Carre,politics
"I'm not into politics but I am committed to a cause: ensuring design technology and engineering stays on the U.K. curriculum, alongside science and maths - grounding abstract theory, merging the practical with the academic.",James Dyson,politics
"I could have made a fortune in cheeseburgers, but I finally chose politics.",Francois Hollande,politics
"One of the things that's great about New York is that it is not a one-industry town. It has education, academia, the service industry, arts, publishing, theater, politics, fashion, finance, as well as movie-making.",Sarah Jessica Parker,politics
"There are three critical ingredients to democratic renewal and progressive change in America: good public policy, grassroots organizing and electoral politics.",Paul Wellstone,politics
It is the belief that extremes and excesses of inequality must be reduced so that each person is free to fully develop his or her full potential. This is why we take precious time out of our lives and give it to politics.,Paul Wellstone,politics
Politics is not about money.,Paul Wellstone,politics
Politics is not about power.,Paul Wellstone,politics
Politics is not about winning for the sake of winning.,Paul Wellstone,politics
"Politics is not predictions and politics is not observations. Politics is what we do. Politics is what we do, politics is what we create, by what we work for, by what we hope for and what we dare to imagine.",Paul Wellstone,politics
We can and must move U.S. politics forward by means of committed participation.,Paul Wellstone,politics
"If you really want to diminish a candidate, depict him as the foil of his handler. This is as old in American politics as politics itself.",Karl Rove,politics
"Look, there ought to be politics in politics.",Karl Rove,politics
"The fallback position in politics is if you don't know what you want to be about, and if you don't know what your vision is, go at somebody else.",Karl Rove,politics
Negative politics have always been around.,Karl Rove,politics
I'll never get out of politics. I have friends in public office. I have things that I want to do. You can't go back in life. I won't go back to the existence I had before of running a political consulting firm and signing up clients and advising campaigns in exactly that way.,Karl Rove,politics
I know enough about European politics to know you've got a lot of crazy people who make their way onto the ballot.,Karl Rove,politics
"One thing I have learned in my time in politics is that if one of the parties is shameless, the other party cannot afford to be spineless.",Frank Lautenberg,politics
"What is more comforting to the terrorists around the world: the failure to pass the 9/11 legislation because we lacked 'a majority of the majority,' or putting aside partisan politics to enact tough new legislation with America's security foremost in mind?",Rahm Emanuel,politics
"I don't want to spend the rest of my life in politics. When I'm finished with my term as governor, I'm going back to the life that's waiting for me in the private sector.",Jesse Ventura,politics
Politics is not my life. I have a career in radio and another career in film.,Jesse Ventura,politics
"I'm not a political person. When I start to get into it, it just upsets me. I feel so powerless when it comes to politics. So I've just decided to be non-political and very, very pro-soldier.",Channing Tatum,politics
Politics is my hobby. Smut is my vocation.,Larry Flynt,politics
"In politics, the number of women in the cabinet has fallen and, if current poll trends continue and Labour loses a number of marginal seats, the number of female MPs is likely to drop significantly.",Lucy Powell,politics
"The Labour party has done more than any other to address gender inequalities, through legislation and other means, and to increase women's representation in politics, which has led to recent increases in the number of female politicians.",Lucy Powell,politics
"For sure, the 'Obamania' that's fast taking hold reflects an incredible thirst for change in global politics and, dare I say, a wave of optimism that things can be different.",Lucy Powell,politics
"We need to dig deep and give people a reason to be optimistic just as Obama is doing in America. Because in the same way that outcome of the U.S. elections will change the course of events there and around the world, so too do politics here in Britain.",Lucy Powell,politics
"Being out and about talking to residents and representing their views is, in my view, as important to politics as the grandstanding that takes place in Westminster.",Lucy Powell,politics
"Economics, politics, and personalities are often inseparable.",Charles Edison,politics
"Unfortunately the global warming hysteria, as I see it, is driven by politics more than by science.",Freeman Dyson,politics
Politics is show business for ugly people.,Paul Begala,politics
"Religion has to stay in the heart, not in politics. It is private.",Tahar Ben Jelloun,politics
"I'm not going to talk like I know about politics, because I'm a total amateur, but maybe I can be a spokesperson for people who aren't normally interested in politics.",Bjork,politics
"But I'm not interested in politics. I lose interest the microsecond it ceases to be emotional, when something becomes a political movement. What I'm interested in is emotions.",Bjork,politics
Politics is a highly tribal business.,Nick Clegg,politics
"You have a political and media elite who have an idiom by which they describe politics. It's highly, highly polarised. It's right, left, red, blue, up, down, victorious, crushed.",Nick Clegg,politics
"I didn't become leader to transform the Liberal Democrats into an enlarged form of the Electoral Reform Society. It's not the be all and end all for us. There are other very, very key ambitions in politics, not least social mobility and life chances, that I care about as passionately if not more.",Nick Clegg,politics
"I have got instincts that, I think, are very much in tune with people's very keen sense to see something different. I did not dream of being in politics since I was knee-high to a grasshopper. I was not involved in student politics, or not in that partisan way.",Nick Clegg,politics
"What I hope is in five years' time, I can go to the British people in the election and say: Lots of you doubted that coalition politics worked, but it has worked.",Nick Clegg,politics
