People say you should read your criticism because it will make you a better person but it doesn't. It just makes you a sad bitter old showbiz nightmare.,Jo Brand,sad
"The sad part about our past is that religions, ironically enough, are responsible for creating the most destructive idea that has ever been visited upon the human race: the idea that there is such a thing as 'better.'",Neale Donald Walsch,sad
Among the reasons people keep sad stories to themselves is that they do not want anyone to feel sorry for them. I don't. I don't want you to feel sorry for me.,Judith Moore,sad
I think I would be very sad if I wasn't able to have a baby.,Nicole Kidman,sad
I was sad that Corpse Bride was so short. I would've liked to have had her around for way longer. She doesn't actually have that many scenes.,Helena Bonham Carter,sad
A lot of sad stories in a row - that wears on you.,Elizabeth Edwards,sad
"When you're going through something, whether it's a wonderful thing like having a child or a sad thing like losing somebody, you often feel like 'Oh my God, I'm so overwhelmed I'm dealing with this huge thing on my own.' In fact, poetry's a nice reminder that, no, everybody goes through it. These are universal experiences.",Caroline Kennedy,sad
"The question I love to get asked is: 'What's the hardest part of your job?' And literally, the answer is probably real sad, but it's to just to be me. Like, it's really hard, because I think people, you know, have a set idea of what a pop star should be.",Kelly Clarkson,sad
"It's really a sad story, and I liked that. The songs on this album talk about relationships in every aspect.",Aaliyah,sad
"Even modern English people are imperious, superior, ridden by class. All of the hypocrisy and the difficulties that are endemic in being British also make it an incredibly fertile place culturally. A brilliant place to live. Sad but true.",Pete Townshend,sad
It's sad when people break up.,Pete Townshend,sad
"I don't know what to say to that, but I have to agree with Johnny that, yeah, we do touch upon things that most men would rather not admit: That we feel pain, we cry, get sad and sometimes don't deal well with disappointment.",Peter Steele,sad
"I once made the mistake of going for a whole row of false eyelashes, which was just wrong as it gave me a sad, puppy-eyed look.",Sienna Miller,sad
"My comedy is for children from three to 93. You do need a slightly childish sense of humour and if you haven't got that, it's very sad.",Norman Wisdom,sad
"Being on your own would be sad, sick and weird. I don't trust myself. I need that balance.",Daniel Craig,sad
"It's sad that the most glorious of sexual experiences can make us feel guilty, ashamed, embarrassed, and abnormal.",Sue Johanson,sad
"The sad thing is that I feel so boring because 'Twilight' is literally how every conversation I have these days begins - whether it's someone I'm meeting for the first time or someone I just haven't seen in a while. The first thing I want to say to them is, 'It's insane! And, as a person, I can't do anything!'",Kristen Stewart,sad
Los Angeles can be a really sad city.,Adam Lambert,sad
"For my wrap present, Colin Farrell gave me a first edition book. I got so involved with this character and I was so sad when the movie was over that when I got home and I tried to read the book I got really emotional and I started crying.",Salma Hayek,sad
"If I get the forty additional years statisticians say are likely coming to me, I could fit in at least one, maybe two new lifetimes. Sad that only one of those lifetimes can include being the mother of young children.",Anna Quindlen,sad
It's much easier to write when you're sad. But you can end up isolated and depressed because you almost need to put yourself in that situation to have that angst to write from.,Natalie Imbruglia,sad
"The monarchy is foremost a business, and it's important to them that the British public continue to finance the excessive luxurious lifestyles of the now quite enormous, wasteful and useless 'royal' family. I find it very sad.",Steven Patrick Morrissey,sad
What's really sad is that so many young women between the ages of 16 and 25 are ignorant and they already believe that women get the same pay as men. They don't even really understand that equality hasn't happened with the pay force.,Bell Hooks,sad
"There's never been a culture that wasn't obsessed with food. The sort of sad thing is that our obsession is no longer with food, but with the price of food.",Jonathan Safran Foer,sad
"I was a very good girl for a long time, that's what really drew me to acting. The stage was the perfect place to be outrageous, to be sad, to be angry, to be all these different things.",Joan Allen,sad
"But I'm not like sad, depressed miserable person. I guess sometimes I give off that impression.",Edward Furlong,sad
"I've got to be high class... Which is sad, because I like bars.",Daniel Craig,sad
"I didn't know my mother had it. I think a lot of women don't know their mothers had it that's the sad thing about depression. You know, you don't function anymore. You shut down. You feel like you are in a void.",Marie Osmond,sad
"I would love to be married. But it's not a necessity like the way that I feel I need and want to have children. It would be wonderful to have a husband, and I would feel blessed to do it. But I would feel sad for the rest of my life if I had no kids.",Mindy Kaling,sad
"You know, why at the end of your life should you assemble thousands of pages of 'Why am I so sad, why am I so depressed?' Instead, assemble thousands of pages of why you're so content.",Elizabeth Gilbert,sad
"As somebody who, in my second marriage, insisted on a prenuptial agreement, I can also testify that sometimes it is an act of love to chart the exit strategy before you enter the union, in order to make sure that not only you, but your partner as well, knows that there will be no World War III should hearts and minds, for any sad reason, change.",Elizabeth Gilbert,sad
"As a songwriter I hate this whole, 'If it's a sad song, it has to sound like a sad song thing.' And that goes all the way back to my days with the Format. I'm an insane narcissist, so if I have to get something off my chest, I'll get something off my chest.",Nate Ruess,sad
"I remember a time when all my fans were crying and sad and going through hell. Now, we're trying to uplift each other and accept ourselves for who we are, even if nobody else does.",Mary J. Blige,sad
"I feel quite sad for the young musicians coming up because they may never get to pay their rent properly. It doesn't matter what the genre nowadays, it's so much harder than it ever was.",Bryan Adams,sad
"The attacks on the World Trade Center and the Pentagon shook our nation to the core. Americans were deeply frightened, sad, and angry, and they rallied around a President who, at the time, showed impressive certitude and calm.",Eliot Spitzer,sad
It is a historical error for those who were not there to just refer to August 28th as 'I Have a Dream' speech day. That is a real disservice to those who were there. It was a sad day. It was not a celebration environment.,Jesse Jackson,sad
"Even when I'm in quite a happy state of mind, I like writing really sad songs. I think a lot of people do.",Ellie Goulding,sad
"I'd like a male to listen to my music and find it kind of fascinating, what a girl goes through when they get heartbroken or get sad or get hurt by something.",Ellie Goulding,sad
"'I Know You Care' is about my dad. And I haven't seen him for a long, long time. And my parents divorced when I was really young. And I guess I just wanted a - it was my way of saying that I wasn't bitter or angry anymore. I was just sad and just felt like something was missing.",Ellie Goulding,sad
"Well, darkness with humor... I'm not an extremely suicidal or sad person.",Peter Steele,sad
I think it is really sad that when people lose their homes they kind of lose their minds too.,Margaret Cho,sad
"You can't have an up without a down, a right without a left, a back without a front - or a happy without a sad.",Harlan Coben,sad
"At a time when 2500 American soldiers have given their lives for the cause of bringing democracy to Iraq, it is sad and frustrating to watch the Republican establishment disgrace the exercise of democracy in our own House of Representatives.",Earl Blumenauer,sad
"All he cares about is going out there with his Jack Daniels bottle. Nothing has changed. That's kind of sad. If David was doing better than he used to be, then that would be different. But it was a joke and he made it that way.",Sammy Hagar,sad
The sad thing about artificial intelligence is that it lacks artifice and therefore intelligence.,Jean Baudrillard,sad
"The first series I wrote, 'L.A. Candy,' was always meant to be a three-book series, so when I started out it was all outlined that way and by the time I was done with the third book, I had become so involved and the process and the stories, I was a little bit sad to be done.",Lauren Conrad,sad
It is sad to see a woman sacrificing the ties of the affections even to do good.,Maria Mitchell,sad
"What I really tried to do with Helen was make her show this sad side of her. She was married off at 16, was so young and living in this castle that can't leave because of how she looks, and married to a man she hates and three times her age.",Diane Kruger,sad
"You know, I think we Indians are afraid to show and celebrate our happiness, lest things change around. But I feel that it's okay to be sad and okay to show when you are happy.",Shahrukh Khan,sad
It is easy enough to praise men for the courage of their convictions. I wish I could teach the sad young of this mealy generation the courage of their confusions.,John Ciardi,sad
"When I design and wonder what the point is, I think of someone having a bad time in their life. Maybe they are sad and they wake up and put on something I have made and it makes them feel just a bit better. So, in that sense, fashion is a little help in the life of a person. But only a little.",Miuccia Prada,sad
"I am firmly of the opinion that women who make a lot of effort to hang onto their looks in middle age (unless they are beauties, entertainers or prostitutes) are rather sad, as one should surely have something more substantial to recommend one by this time, such as kindness or cleverness.",Julie Burchill,sad
"No matter how old and glorious the models, sad indeed is the woman who sees fashion as a means of self-expression rather than an agent of social control.",Julie Burchill,sad
"As a writer, or as a filmmaker, you have to present yourself, and part of what yourself is is what you're interested in, or what you think is funny, or what you think is sad, or what you think is horrible.",Charlie Kaufman,sad
My solo album is dead and buried. We had the funeral. It was sad and I cried a lot but it made such a beautiful corpse that we had an open casket.,Shirley Manson,sad
"We're sad about some of the losses of members of great seniority and distinction in the Congress, and some very new members, who will no longer be serving with us.",Nancy Pelosi,sad
"I know what I look like - a weird, sad clown puppet. I'm fine with that.",Rainn Wilson,sad
"Acting gave me the opportunity to do outrageous things. It allowed me to be sad, happy, angry and lustful, even if it was just vicariously.",Joan Allen,sad
The old know what they want the young are sad and bewildered.,Logan P. Smith,sad
"The best quality about Kobe Bryant? You want me to be honest? I don't know. I'll tell you why. I open my arms to everybody. But he never stepped forward for the embrace. So I never really got to know him. I don't know anything about him, and it's kinda sad.",Shaquille O'Neal,sad
Stories have always been the things that entertain me and make me feel happy and sad and move me and give me the experience of being able to live many lives in one lifetime. It's the best thing about being alive.,Michael Sheen,sad
"For a culture that has such a problem with death, we seem to deal with it in a quite bizarre way. We see people shot, killed and blown up, and we find it funny and sexy and all those things. But, the reality of it is that every day people die, and people are really sad and they grieve and they go through a really difficult process with it.",Michael Sheen,sad
"With my schedule being so crazy, I can't call every day or hang out with my friends like I used to and that's definitely sad.",Jordin Sparks,sad
"The '80s were fabulous. The '90s sucked, and the '70s were just a sad, sad time in human history. Go 1980s! There's something that's just so cute about that time. And not just yellow nail polish and 'I'm a loner.'",Jennifer Sky,sad
It is very sad for a man to make himself servant to a single thing his manhood all taken out of him by the hydraulic pressure of excessive business.,Theodore Parker,sad
Watergate provides a model case study of the interaction and powers of each of the branches of government. It also is a morality play with a sad and dramatic ending.,Bob Woodward,sad
"Of course it's true: the public want to see young people - young people are the people who go to the cinema. It's a sad fact of life, but you've got to accept it and not whine about it.",Joan Collins,sad
I'm not sad at all about turning 40.,Halle Berry,sad
"My dad was a homicide cop in the gay neighborhood in the city when gay neighborhoods were desperate, depressing, sad places run by the mob. The only gay people he'd met when I came out to him were corpses.",Dan Savage,sad
"A marriage is no amusement but a solemn act, and generally a sad one.",Queen Victoria,sad
I do not take steroids. I never have. It's sad to me that people want to point fingers. I don't do that. That's not me. I wouldn't feel like a human being.,Jackie Joyner-Kersee,sad
When I moved out of my mom's house at 18 I was almost as sad to leave her sewing machine behind as anything else.,Beth Ditto,sad
I love sad songs. They say so much. I love country music but even the happy songs sound really sad.,Beth Ditto,sad
I was at the Olympic Games winning medals and I still doubted my image. I doubted what I looked like. That's sad.,Shawn Johnson,sad
I happen to be interested in watching a face age. I like faces of women aging so it makes me personally quite sad. That's a beautiful gift from God. If people don't want to see that anymore then I won't be in anymore movies.,Debra Winger,sad
"Apart from the fact that your physical ability starts to decline, I also think someone in their fifties being childlike becomes a little sad. You've got to be careful.",Rowan Atkinson,sad
I've met so many fans of daytime television who've watched the shows with their moms and grandmas and feel like they've known the characters their whole lives. It's sad for them to have to say goodbye to their favorite soaps and characters. We don't want that to happen to the 'Days' fans.,Alison Sweeney,sad
It's a sad day when the leaders of the free world engage in such deception and trickery. I voted against this unnecessary war and will continue to argue that the best way to support our troops is to bring them home.,Major R. Owens,sad
Nobody wants to hear R&ampB. It's sad. If you want to be on the radio you got to stay young.,Jamie Foxx,sad
"I've never thought of my characters as being sad. On the contrary, they are full of life. They didn't choose tragedy. Tragedy chose them.",Juliette Binoche,sad
"You listen to a piece of music and it will remind you of something - it might make you happy, it might make you sad, but it is very emotive. And I think that Duran Duran have always understood that.",Nick Rhodes,sad
"I was sad to see anybody leave, we had a very nice family on that show. I was very sad to see momma go, Victoria and especially Linda. My god that was my wife on the show, in fact my wife calls her wife.",Larry Hagman,sad
"Women get the attention when we get into the men's arena, and that's sad.",Billie Jean King,sad
"You had to be into sport and, sad to say, I'm a traitor to my country because I don't have a sporting bone in my body.",Geoffrey Rush,sad
"I didn't want to be on the losing side. I was fed up with Jewish weakness, timidity and fear. I didn't want any more Jewish sentimentality and Jewish suffering. I was sickened by our sad songs.",Lionel Blue,sad
"I think as an American society, when we're paying too many taxes or dealing with war, we don't want to see sad things at the movies.",Zoe Saldana,sad
"My lasting impression of Truman Capote is that he was a terribly gentle, terribly sensitive, and terribly sad man.",Alvin Ailey,sad
Dwight is a sad clown. You've seen those paintings of sad clown.,Rainn Wilson,sad
"I find it sad that by not talking about who I sleep with, that makes me mysterious. There was a time when I would have been called a gentleman.",Kevin Spacey,sad
You know how sad your life is when you know the release date of DVDs.,Heston Blumenthal,sad
"I was in a bar and I said to a friend, 'You know, we've become those 40-year-old guys we used to look at and say, 'Isn't it sad?'",George Clooney,sad
"I love music videos, I really do. I think it's kind of sad that it's a dying art form.",Adam Levine,sad
Wearing a tuxedo isn't as simple as it sounds. I've been to a lot of award shows in Hollywood over the years and have seen some pretty sad tuxes. It's surprisingly easy to go off the rails.,Paul Feig,sad
"In their heyday, the Pet Shop Boys were the Interpol of the Eighties, dressing up to sing really weird pop songs about lust and loneliness in the big city. They're low-pro now, not retro-worshipped in the manner of Depeche Mode, New Order, or The Cure, but you can hear the reason why - these guys are too sad.",Rob Sheffield,sad
It makes me so desperately sad to witness just how unforgivably wretched our world has become.,Ralph Steadman,sad
"Marketing has supplanted story as the primary force behind the worthiness of making a film, and that's a very sad thing. It's film only as a function of consumerism rather than as an important component of our culture, and that's everywhere around the world.",Alexander Payne,sad
"I always think of the live show first, where the song is gonna go in the show. That's why they aren't sad songs. When I play, I want to make people happy, not sad. It's such a pleasure for me to do what I do, and I want other people to feel some form of that pleasure, too.",Jason Mraz,sad
"I find it amusing on one level, poignant on another, when people try to get recognition from an outside source. It's sad.",Grace Slick,sad
"Divorce was very sad, obviously, but now I've gotten over it.",Natalie Imbruglia,sad
"I like singer-songwriters, and I find sad songs comforting rather than depressing. It makes you realise you're not alone in the world.",Natalie Imbruglia,sad
"With any group of people in life, sad things happen, and crazy things, and happy things. When you're in the public eye, it's just amplified, that's all.",Margot Kidder,sad
"The sad events that occur in my life are the sad events that happen to everybody, with losing friends and family, but that is a natural occurrence, as natural as being born.",Sergio Aragones,sad
It's always sad if anybody you know has a personal problem.,Lee Child,sad
The sad and horrible conclusion is that no one cared that Jews were being murdered... This is the Jewish lesson of the Holocaust and this is the lesson which Auschwitz taught us.,Ariel Sharon,sad
Whenever the lion fish in the fish tank in the captain's ready room died it was always a sad moment.,Patrick Stewart,sad
"I find America falling in love with a TV show flattering and interesting, but at the same time a little sad.",David Schwimmer,sad
"If I can procure three hundred good substantial names of persons, or bodies, or institutions, I cannot fail to do well for my family, although I must abandon my life to its success, and undergo many sad perplexities and perhaps never see again my own beloved America.",John James Audubon,sad
"My mother sent me to psychiatrists since the age of four because she didn't think little boys should be sad. When my brother was born, I stared out the window for days. Can you imagine that?",Andy Kaufman,sad
"51st State was one that I loved doing because the character was so out there, and in a way I was sad to leave the character behind. I'm afraid I could never be that cool in real life!",Emily Mortimer,sad
"You have to sound sad first of all, then maybe later you can sound good.",Steve Lacy,sad
"I often feel like I have this spirit living inside of me, always dressing in like short mini skirts... but then I start to discover myself. So there are eight spirits, mischievous ones, sad ones, handsome ones, wise ones, and crazy ones.",Bai Ling,sad
"At that time, I feel sad, and I feel no one knows how hard I work and how many tears. They only know the score. At that time, I feel very lonely because no one understands since they haven't been world No. 1 before.",Yani Tseng,sad
Everything takes me longer than I expect. It's the sad truth about life.,Donna Tartt,sad
"I have had stalkers over the years. The police deal with it but it is very scary. One man kept turning up where we filmed 'Countdown in Leeds,' which was scary. It was sad as he'd been sectioned and thought I was talking to him through the TV.",Carol Vorderman,sad
Just because I'm talking about something that might have been a sad or painful situation doesn't mean that I'm sad or tortured 24 hours a day any more than anybody else is.,Lucinda Williams,sad
"I think that's very sad, that I haven't allowed my heart to be broken. I have broken a few.",Sally Field,sad
"You will soon find that I am a bit obsessive about my work. And that is a little sad, one often feels strangely restricted, not finding time to simmer, although one actually has many interests.",Arne Jacobsen,sad
"I've traveled around the country and I read local newspapers and all of that, and it's a sad, sad thing to go from city to city and see the small newspapers and they're tiny. They're tiny not only in size but also in scope.",Jim Lehrer,sad
"Ladies and gentlemen, it is with great sadness that I announce that I will resign as Australia's Minister for Foreign Affairs. I am sad because I love this job. I'm totally dedicated to the work that we are doing in Australia's name around the world, and I believe that we have achieved many good results for Australia, and I'm proud of them.",Kevin Rudd,sad
"In film, you can have sad endings.",Anna Torv,sad
I'm a person who likes these sort of movies... sad but moving 'art movies' that normally are at a festival and then they go to a small art house theater and disappear.,Zach Braff,sad
"If I was sad or afraid, I would sit in a corner and sing. If I was happy I would jump into the middle of the room and sing. It was how I expressed my emotions.",Nana Mouskouri,sad
It's incredible that they censor films. It's sad.,Dario Argento,sad
"People say, oh it's a shame, you're not nostalgic about the '60s. Well actually, it's quite good, when you think of it. Wouldn't it be sad if I was sitting here wishing it back?",Robert Wyatt,sad
"I'm so grounded, it's sad.",Patti LaBelle,sad
I'm sad to see the passing of the great drug warriors. I certainly did my part in that battle and I don't regret any of it.,Marc Maron,sad
"When I look back at those pictures of my mother performing - and listen to her recordings - it makes me sad to think that all of that joy she found in her work came to an end. I wish she hadn't had to make that sacrifice, even if it was for the benefit of my father and siblings and me.",Marlo Thomas,sad
"If I don't make it, I'll be very sad that there are things I didn't do, but I'm happy that I've done what I have.",Stephen Jay Gould,sad
I'm not sad about any of my life. It's so unconventional. It doesn't look anything like I thought it would.,Edie Falco,sad
"I've always been drawn to Marilyn Monroe, but certain aspects of her story may be too sad to tell.",Sherilyn Fenn,sad
"Here in the United States, our profession is much maligned, people simply don't trust or like journalists anymore and that's sad.",Christiane Amanpour,sad
"'The Taxi Ride,' from my second album, is one people want to hear a lot. I'm consciously trying to walk on the sunny side of the street, to really lift myself into a place of greater positivity, and that's a sad song.",Jane Siberry,sad
"We have newsreaders behaving like actors, lowering their voices if it's a sad story, as if we didn't know it's a sad story. There isn't a single cool newsreader.",Tom Baker,sad
And it's sad because it's like a surprise to people - almost an anomaly - when artists are actually refined and trained on an instrument. That's the last thing people think about.,Vanessa Carlton,sad
"Home will always be Northern Ireland but my schedule means for the next few years I won't be there as much. I can't do the same things that I did a year ago. That is I'm something conscious of, but I'm not sad about it. It's fine.",Rory McIlroy,sad
"Love Is Louder is a movement that is hopefully going to bring some awareness and make some noise when it comes to teens who are feeling suicidal or even just sad, outcasts, and being bullied, and really feel like they have nowhere to turn to.",Brittany Snow,sad
Atari is a very sad story.,Steve Wozniak,sad
"In Mississippi, you don't admit that you're gay. It's just an awkward thing down South, which is sad.",Lance Bass,sad
"You know, the sad thing of post-9/11, which was of course horrific, was that the city in which I felt completely at home for two decades, suddenly people like us - brown people - were looked at as the 'Others.'",Mira Nair,sad
"There is no such thing as death. In nature nothing dies. From each sad remnant of decay, some forms of life arise so shall his life be taken away before he knoweth that he hath it.",Charles Mackay,sad
