War is very sad and small life is pathetically fragile at times.,Henry Rollins,war
"Nowadays it is the fashion to emphasize the horrors of the last war. I didn't find it so horrible. There are just as horrible things happening all round us today, if only we had eyes to see them.",Ludwig Wittgenstein,war
War is a profane thing.,Norman Schwarzkopf,war
"Could I have but a line a century hence crediting a contribution to the advance of peace, I would yield every honor which has been accorded by war.",Douglas MacArthur,war
"No event in American history is more misunderstood than the Vietnam War. It was misreported then, and it is misremembered now.",Richard M. Nixon,war
"To delight in war is a merit in the soldier, a dangerous quality in the captain, and a positive crime in the statesman.",George Santayana,war
"All the miseries and evils which men suffer from vice, crime, ambition, injustice, oppression, slavery and war, proceed from their despising or neglecting the precepts contained in the Bible.",Noah Webster,war
"War is the remedy that our enemies have chosen, and I say let us give them all they want.",William Tecumseh Sherman,war
This administration here and now declares unconditional war on poverty.,Lyndon B. Johnson,war
I'm tired. I'm tired of feeling rejected by the American people. I'm tired of waking up in the middle of the night worrying about the war.,Lyndon B. Johnson,war
"As a result of my philosophy, I wasn't even upset about Hitler. I was willing to go to war to knock him off, but I didn't hate him. I hated what he was doing.",Albert Ellis,war
"War contains so much folly, as well as wickedness, that much is to be hoped from the progress of reason.",James Madison,war
"War can only be abolished through war, and in order to get rid of the gun it is necessary to take up the gun.",Mao Zedong,war
The decadent international but individualistic capitalism in the hands of which we found ourselves after the war is not a success. It is not intelligent. It is not beautiful. It is not just. It is not virtuous. And it doesn't deliver the goods.,John Maynard Keynes,war
"Organize, agitate, educate, must be our war cry.",Susan B. Anthony,war
"Democracies are indeed slow to make war, but once embarked upon a martial venture are equally slow to make peace and reluctant to make a tolerable, rather than a vindictive, peace.",Reinhold Niebuhr,war
"You cannot be President of the United States if you don't have faith. Remember Lincoln, going to his knees in times of trial in the Civil War and all that stuff.",George H. W. Bush,war
"This is an important book, the critic assumes, because it deals with war. This is an insignificant book because it deals with the feelings of women in a drawing-room.",Virginia Woolf,war
"If we help an educated man's daughter to go to Cambridge are we not forcing her to think not about education but about war? - not how she can learn, but how she can fight in order that she might win the same advantages as her brothers?",Virginia Woolf,war
People always make war when they say they love peace.,David Herbert Lawrence,war
"I love it when Muslims go to war with each other, as I do when the Christians do, because it shows there's no such thing as the Christian world and the Islamic world. That's all crap.",Christopher Hitchens,war
It is Barack Obama who is at war with this country. Recent events prove it. This is not a cliche. It's not a figure of speech. Obama is at war with the U.S. economy.,Rush Limbaugh,war
"All this happened, more or less. The war parts, anyway, are pretty much true.",Kurt Vonnegut,war
A peace that depends on fear is nothing but a suppressed war.,Henry Van Dyke,war
"A self-respecting nation is ready for anything, including war, except for a renunciation of its option to make war.",Simone Weil,war
"What a country calls its vital... interests are not things that help its people live, but things that help it make war.",Simone Weil,war
"Sectional football games have the glory and the despair of war, and when a Texas team takes the field against a foreign state, it is an army with banners.",John Steinbeck,war
"War can be avoided, and it ought to be avoided. I want no war.",Chief Joseph,war
"I said in my heart that, rather than have war, I would give up my country.",Chief Joseph,war
I saw clearly that war was upon us when I learned that my young men had been secretly buying ammunition.,Chief Joseph,war
I saw that the war could not be prevented. The time had passed.,Chief Joseph,war
"We had good white friends who advised us against taking the war path. My friend and brother, Mr. Chapman, told us just how the war would end.",Chief Joseph,war
The condition of man... is a condition of war of everyone against everyone.,Thomas Hobbes,war
"War never takes a wicked man by chance, the good man always.",Sophocles,war
"In order for a war to be just, three things are necessary. First, the authority of the sovereign. Secondly, a just cause. Thirdly, a rightful intention.",Thomas Aquinas,war
"I don't believe war is a way to solve problems. I think it's wrong. I don't have respect for the people that made the decisions to go on with war. I don't have that much respect for Bush. He's about war, I'm not about war - a lot of people aren't about war.",Avril Lavigne,war
The only way human beings can win a war is to prevent it.,George C. Marshall,war
The terrorists and their supporters declared war on the United States - and war is what they got.,George W. Bush,war
"Virtue is a state of war, and to live in it we have always to combat with ourselves.",Jean-Jacques Rousseau,war
Winning is overrated. The only time it is really important is in surgery and war.,Al McGuire,war
"A man will go to war, fight and die for his country. But he won't get a bikini wax.",Rita Rudner,war
"Really, when it comes to gay rights, there's two wars going on. The first war is political. But the culture war is over.",Dan Savage,war
"God is day and night, winter and summer, war and peace, surfeit and hunger.",Heraclitus,war
"Some have argued that confronting the threat from Iraq could detract from the war against terror. To the contrary, confronting the threat posed by Iraq is crucial to winning the war on terror.",George W. Bush,war
"This was not an act of terrorism, but it was an act of war.",George W. Bush,war
"With those attacks, the terrorists and their supporters declared war on the United States. And war is what they got.",George W. Bush,war
"Hundreds of thousands of American servicemen and women are deployed across the world in the war on terror. By bringing hope to the oppressed, and delivering justice to the violent, they are making America more secure.",George W. Bush,war
"War is to man what maternity is to a woman. From a philosophical and doctrinal viewpoint, I do not believe in perpetual peace.",Benito Mussolini,war
"War is cruelty, and none can make it gentle.",Gilbert Parker,war
"If you want to fight a war on drugs, sit down at your own kitchen table and talk to your own children.",Barry McCaffrey,war
"See, that's why Barack's running: to end the war in Iraq responsibly - to build an economy that lifts every family, to make sure health care is available for every American - and to make sure that every child in this nation has a world-class education all the way from preschool to college.",Michelle Obama,war
War is good when good survives and evil is crushed. If you don't crush evil then evil will get you.,Ted Nugent,war
"For one thing, I don't think that anybody in any war thinks of themselves as a hero.",Steven Spielberg,war
"We can, for example, be fairly confident that either there will be a world without war or there won't be a world - at least, a world inhabited by creatures other than bacteria and beetles, with some scattering of others.",Noam Chomsky,war
"Here's how I think of my money - as soldiers - I send them out to war everyday. I want them to take prisoners and come home, so there's more of them.",Kevin O'Leary,war
"No more war! Never again war! If you wish to be brothers, drop your weapons.",Pope Paul VI,war
War is a blessing compared with national degradation.,Andrew Jackson,war
Be polite write diplomatically even in a declaration of war one observes the rules of politeness.,Otto von Bismarck,war
"God employs several translators some pieces are translated by age, some by sickness, some by war, some by justice.",John Donne,war
How is the world ruled and led to war? Diplomats lie to journalists and believe these lies when they see them in print.,Karl Kraus,war
"War kills men, and men deplore the loss but war also crushes bad principles and tyrants, and so saves societies.",Charles Caleb Colton,war
The natural principle of war is to do the most harm to our enemy with the least harm to ourselves and this of course is to be effected by stratagem.,Washington Irving,war
What is more immoral than war?,Marquis de Sade,war
"Cards are war, in disguise of a sport.",Charles Lamb,war
"Once the command of the air is obtained by one of the contending armies, the war becomes a conflict between a seeing host and one that is blind.",H. G. Wells,war
"There is many a boy here today who looks on war as all glory, but, boys, it is all hell.",William Tecumseh Sherman,war
"Americans are blessed with great plenty we are a generous people and we have a moral obligation to assist those who are suffering from poverty, disease, war and famine.",Adam Schiff,war
"Politics is war without bloodshed, while war is politics with bloodshed.",Mao Zedong,war
"I interviewed survivors, I went to Poland, saw the cities and spent time with the people and spoke to the Jews who had come back to Poland after the war and talked about why they had come back.",Steven Spielberg,war
"When war comes, two things happen - profits go way, way up and all perishables go way, way down. There becomes a market for them.",Steven Spielberg,war
"In the re-creation of combat situations, and this is coming from a director who's never been in one, being mindful of what these veterans have actually gone through, you find that the biggest concern is that you don't look at war as a geopolitical endeavor.",Steven Spielberg,war
"As for charity, it is a matter in which the immediate effect on the persons directly concerned, and the ultimate consequence to the general good, are apt to be at complete war with one another.",John Stuart Mill,war
"Australians are coffee snobs. An influx of Italian immigrants after World War II ensured that - we probably had the word 'cappuccino' about 20 years before America. Cafe culture is really big for Aussies. We like to work hard, but we take our leisure time seriously.",Hugh Jackman,war
I guess if people couldn't profit from war I don't think there would be war.,Lily Tomlin,war
"My hope is that gays will be running the world, because then there would be no war. Just a greater emphasis on military apparel.",Roseanne Barr,war
"When I grew up, in Taiwan, the Korean War was seen as a good war, where America protected Asia. It was sort of an extension of World War II. And it was, of course, the peak of the Cold War. People in Taiwan were generally proAmerican. The Korean War made Japan. And then the Vietnam War made Taiwan. There is some truth to that.",Ang Lee,war
"As this long and difficult war ends, I would like to address a few special words to the American people: Your steadfastness in supporting our insistence on peace with honor has made peace with honor possible.",Richard M. Nixon,war
"This is not Johnson's war. This is America's war. If I drop dead tomorrow, this war will still be with you.",Lyndon B. Johnson,war
The atomic bomb made the prospect of future war unendurable. It has led us up those last few steps to the mountain pass and beyond there is a different country.,J. Robert Oppenheimer,war
"The rule for effective governance is simple. It is one Ronald Reagan knew by heart. And one that he successfully employed with Social Security and the Cold War. When there is a problem, you fix it. That is the job you have been sent to do and you cannot wait for someone else to do it for you.",Chris Christie,war
Loud peace propaganda makes war seem imminent.,David Herbert Lawrence,war
The war is dreadful. It is the business of the artist to follow it home to the heart of the individual fighters - not to talk in armies and nations and numbers - but to track it home.,David Herbert Lawrence,war
"For peace is not mere absence of war, but is a virtue that springs from, a state of mind, a disposition for benevolence, confidence, justice.",Baruch Spinoza,war
She doesn't understand the concept of Roman numerals. She thought we just fought in world war eleven.,Joan Rivers,war
"I'm finding myself really angry over spending and the deficit. I'm finding myself really angry over what's happening in the Middle East, the decision to stay in Afghanistan indefinitely. I'm angry about cap and trade. And I've been on record for a long time on the failed war on drugs.",Gary Johnson,war
War is delightful to those who have had no experience of it.,Desiderius Erasmus,war
The most disadvantageous peace is better than the most just war.,Desiderius Erasmus,war
War is sweet to those who have not experienced it.,Desiderius Erasmus,war
The time not to become a father is eighteen years before a war.,E. B. White,war
I don't think the war in Afghanistan was ruthlessly enough waged.,Christopher Hitchens,war
"A faction willing to take the risks of making war on the ossified status quo in the Middle East can be described as many things, but not as conservative.",Christopher Hitchens,war
"There are people who cannot forget, as neither do I, the lesson of the years of the Indochina War. Which was, first, that the state is capable of being a murderer. A mass murderer, and a conspirator and a liar.",Christopher Hitchens,war
I have been a gigantic Rolling Stones fan since approximately the Spanish-American War.,Dave Barry,war
"For far too long we've allowed the other side to paint us as racist, as sexist, inhumane war mongers - well, today as a conservative black Republican and former solider, I'm here to set that record straight.",Allen West,war
We cannot be both the world's leading champion of peace and the world's leading supplier of the weapons of war.,Jimmy Carter,war
War: a massacre of people who don't know each other for the profit of people who know each other but don't massacre each other.,Paul Valery,war
War is the ultimate tool of politics.,R. Buckminster Fuller,war
"When we were at peace, Democrats wanted to raise taxes. Now there's a war, so Democrats want to raise taxes. When there was a surplus, Democrats wanted to raise taxes. Now that there is a mild recession, Democrats want to raise taxes.",Ann Coulter,war
Abstract Expressionism - the first American movement to have a worldwide influence - was remarkably short-lived: It heated up after World War II and was all but done for by 1960 (although visit any art school today and you'll find a would-be Willem de Kooning).,Jerry Saltz,war
"All of Koons's best art - the encased vacuum cleaners, the stainless-steel Rabbit (the late-twentieth century's signature work of Simulationist sculpture), the amazing gleaming Balloon Dog, and the cast-iron re-creation of a Civil War mortar exhibited last month at the Armory - has simultaneously flaunted extreme realism, idealism, and fantasy.",Jerry Saltz,war
"War is the statesman's game, the priest's delight, the lawyer's jest, the hired assassin's trade.",Percy Bysshe Shelley,war
"This war differs from other wars, in this particular. We are not fighting armies but a hostile people, and must make old and young, rich and poor, feel the hard hand of war.",William Tecumseh Sherman,war
"That strange feeling we had in the war. Have you found anything in your lives since to equal it in strength? A sort of splendid carelessness it was, holding us together.",Noel Coward,war
A war for a great principle ennobles a nation.,Albert Pike,war
"I hate war. Absolutely, I hate war.",Norman Schwarzkopf,war
"First of all, Saddam did not win the war, even though he says he did, I mean, you know, that's a joke and everybody in the world knows it.",Norman Schwarzkopf,war
"Peace for us means the destruction of Israel. We are preparing for an all-out war, a war which will last for generations.",Yasser Arafat,war
"On average, drug prisoners spend more time in federal prison than rapists, who often get out on early release because of the overcrowding in prison caused by the Drug War.",Michael Badnarik,war
There are two problems for our species' survival - nuclear war and environmental catastrophe - and we're hurtling towards them. Knowingly.,Noam Chomsky,war
Nullification means insurrection and war and the other states have a right to put it down.,Andrew Jackson,war
I don't know why you use a fancy French word like detente when there's a good English phrase for it - cold war.,Golda Meir,war
"A book is a fragile creature, it suffers the wear of time, it fears rodents, the elements and clumsy hands. so the librarian protects the books not only against mankind but also against nature and devotes his life to this war with the forces of oblivion.",Umberto Eco,war
France has lost the battle but she has not lost the war.,Charles de Gaulle,war
I am against all war.,Sophia Loren,war
"I don't know whether war is an interlude during peace, or peace an interlude during war.",Georges Clemenceau,war
Patriotism is an instant reaction that fades away when the war starts.,Mick Jagger,war
I was lucky enough to lead a very successful war.,Norman Schwarzkopf,war
Don't worry about the war. It's all over but the shooting.,Samuel Goldwyn,war
"So I would say God hates war, but God loves every soldier.",Rick Warren,war
War is at its best barbarism.,William Tecumseh Sherman,war
"I know I had no hand in making this war, and I know I will make more sacrifices today than any of you to secure peace.",William Tecumseh Sherman,war
"I would make this war as severe as possible, and show no symptoms of tiring till the South begs for mercy.",William Tecumseh Sherman,war
"I want a world without war, a world without insanity. I want to see people do well. I don't even think it's as much as what I want for myself. It's more what I want for the people around me. That's what I want.",Tom Cruise,war
"That is what war is and dancing it is forward and back, when one is out walking one wants not to go back the way they came but in dancing and in war it is forward and back.",Gertrude Stein,war
War is never fatal but always lost. Always lost.,Gertrude Stein,war
"In a war everybody always knows all about Switzerland, in peace times it is just Switzerland but in war time it is the only country that everybody has confidence in, everybody.",Gertrude Stein,war
There's no doubt that usually a president's public image is enhanced by going to war. That never did appeal to me.,Jimmy Carter,war
I had very good support from Democrats and Republicans all throughout my administration. I had a very high batting average. We added more jobs per year in my four years than any other president since the Second World War.,Jimmy Carter,war
"When I was in the White House, I was confronted with the challenge of the Cold War. Both the Soviet Union and I had 30,000 nuclear weapons that could destroy the entire earth and I had to maintain the peace.",Jimmy Carter,war
All that is needed to set us definitely on the road to a Fascist society is war. It will of course be a modified form of Fascism at first.,John T. Flynn,war
The facts of life are that a child who has seen war cannot be compared with a child who doesn't know what war is except from television.,Sophia Loren,war
World War II was the last government program that really worked.,George Will,war
Politics and war are remarkably similar situations.,Newt Gingrich,war
The biggest problem was the politicians knew nothing about fighting a war.,R. Lee Ermey,war
"Those who have experienced the most, have suffered so much that they have ceased to hate. Hate is more for those with a slightly guilty conscience, and who by chewing on old hate in times of peace wish to demonstrate how great they were during the war.",Thor Heyerdahl,war
"It is only those who have neither fired a shot nor heard the shrieks and groans of the wounded who cry aloud for blood, more vengeance, more desolation. War is hell.",William Tecumseh Sherman,war
There's many a boy here today who looks on war as all glory but it is all hell.,William Tecumseh Sherman,war
War is too serious a matter to leave to soldiers.,William Tecumseh Sherman,war
"If the people raise a great howl against my barbarity and cruelty, I will answer that war is war, and not popularity seeking.",William Tecumseh Sherman,war
You cannot qualify war in harsher terms than I will.,William Tecumseh Sherman,war
"He belonged to that army known as invincible in peace, invisible in war.",William Tecumseh Sherman,war
There must be people who remember World War II and the Holocaust who can help us get out of this rut.,Martin Scorsese,war
Law is always better than war.,Brian Eno,war
"If men make war in slavish obedience to rules, they will fail.",Ulysses S. Grant,war
"I could start a war in 30 seconds. But some countries spend 100 years trying to find peace. Just like good manners, peace has to be learned.",Sylvester Stallone,war
"Here we will solve with laws and dollars, problems that too many people around the world still must solve with violence and civil war.",Marco Rubio,war
"During times of war, hatred becomes quite respectable even though it has to masquerade often under the guise of patriotism.",Howard Thurman,war
The real war is not between the West and the East. The real war is between intelligent and stupid people.,Marjane Satrapi,war
There is so much that must be done in a civilized barbarism like war.,Amelia Earhart,war
"The war on terror is the most insane and immoral war of all time. The Americans are doing what they did in Vietnam, bombing villages. But how can a civilised nation do this? How can you can eliminate suspects, their wives, their children, their families, their neighbours? How can you justify this?",Imran Khan,war
"It was quite a European war until 1917, when the Americans joined up. They don't have the same sense of the loss of innocence and the cataclysmic loss of life. A whole generation was wiped out.",Tom Hiddleston,war
"I always found the extraordinary loss of life in the First World War very moving. I remember learning about it as a very young child, as an eight- or nine-year-old, asking my teachers what poppies were for. Every year the teachers would suddenly wear these red paper flowers in their lapels, and I would say 'What does that mean?'",Tom Hiddleston,war
"I did a production of 'Journey's End,' an RC Sherriff play about World War I, at the Edinburgh Festival. I was 18 and it was the first time that people I knew and loved and respected came up to me after the show and said, 'You know, you could really do this if you wanted to.'",Tom Hiddleston,war
"This is a war universe. War all the time. That is its nature. There may be other universes based on all sorts of other principles, but ours seems to be based on war and games.",William Burroughs,war
"Officials at the White House are saying that President Bush hasn't changed his schedule much since the war started. The main difference, they say, is that he's started watching the news and taping Sponge Bob.",Conan O'Brien,war
"The U.S. army confirmed that it gave a lucrative fire fighting contract in Iraq to the firm once run by the Vice President Dick Cheney without any competitive bidding. When asked if this could be conceived as Cheney's friends profiting from the war, the spokesman said 'Yes.'",Conan O'Brien,war
"The Canadian government continues to say they will not help us if we go to war with Iraq. However, the prime minister of Canada said he'd like to help, but he's pretty sure that last time he checked, Canada had no army.",Conan O'Brien,war
Television brought the brutality of war into the comfort of the living room. Vietnam was lost in the living rooms of America - not on the battlefields of Vietnam.,Marshall McLuhan,war
"I feel like the people from Iceland have a different relationship with their country than other places. Most Icelandic people are really proud to be from there, and we don't have embarrassments like World War II where we were cruel to other people.",Bjork,war
We have been terrorised by what happened in America and we express our condolences to the American people who suffered from this unexpected catastrophe and a new world war.,Muammar al-Gaddafi,war
Our poverty will be brought home to us to its full extent only after the war.,Joseph A. Schumpeter,war
God has been pleased to save us during the years of war that have already passed. We pray that He may be pleased to save us to the end. But we must do our part.,Eamon de Valera,war
"War is not the continuation of politics with different means, it is the greatest mass-crime perpetrated on the community of man.",Alfred Adler,war
War is organized murder and torture against our brothers.,Alfred Adler,war
"We need to decide that we will not go to war, whatever reason is conjured up by the politicians or the media, because war in our time is always indiscriminate, a war against innocents, a war against children.",Howard Zinn,war
"I don't like war. I particularly don't like the celebration of war, which I think the administration is a little bit guilty of.",Neil Young,war
"During the time men live without a common power to keep them all in awe, they are in that conditions called war and such a war, as if of every man, against every man.",Thomas Hobbes,war
Making peace is harder than making war.,Adlai E. Stevenson,war
"When you get billions in aid and your weapons resupplied and your ammunition stock resupplied, you don't learn the lesson that war is bad and nobody wins.",King Abdullah II,war
