What a man knows is everywhere at war with what he wants.,Joseph Wood Krutch,war
I was a little girl in World War II and I'm used to being freed by Americans.,Madeleine Albright,war
"The U.N. bureaucracy has grown to elephantine proportions. Now that the Cold War is over, we are asking that elephant to do gymnastics.",Madeleine Albright,war
I know that war is very cruel and that life is harder when you aren't able to live in the place you called home.,Madeleine Albright,war
I saw what happened when a dictator was allowed to take over a piece of a country and the country went down the tubes. And I saw the opposite during the war when America joined the fight.,Madeleine Albright,war
"I had nearly finished school because I was making effort not that bad on that. But there was a law in Germany after the war. You could not make your final examination before 18, so lots of people who were late because of the way had to do it first.",Karl Lagerfeld,war
"There is a peculiar burning odor in the room, like explosives. the kitchen fills with smoke and the hot, sweet, ashy smell of scorched cookies. The war has begun.",Alison Lurie,war
"There's an assault on human sexuality, as Judge Scalia said, they've taken sides in the culture war and on top of that if we have a democracy, the democratic processes should be that we can elect representatives who will share our point of view and vote those things into law.",Pat Robertson,war
There's no question that jihad historically means war.,Pat Robertson,war
"Do you know what a soldier is, young man? He's the chap who makes it possible for civilised folk to despise war.",Allan Massie,war
The skirmishes in the occupied land are part of the war of destiny. The outcome of hundreds of years of war will be defined in Palestinian land.,Mahmoud Ahmadinejad,war
"I certainly notice the vitality in Belfast, which wasn't there in the Seventies. There was a war going on then. Now there are cranes everywhere. There really is a sense of renewal and hope.",Liam Neeson,war
A war still rages over the legacy of the 1960s.,Camille Paglia,war
"American policy seems to be wed to a perpetual state of war. Why? History shows that the world will always be in flux or turmoil, with different peoples competing for visibility and power. The U.S. cannot fix the fate of every nation.",Camille Paglia,war
Mine is the first generation able to contemplate the possibility that we may live our entire lives without going to war or sending our children to war.,Tony Blair,war
"We should seek by all means in our power to avoid war, by analysing possible causes, by trying to remove them, by discussion in a spirit of collaboration and good will.",Neville Chamberlain,war
I was a soldier in WWII. The last couple of months of the war I was actually in combat.,Mel Brooks,war
"On the justification for the war, it wasn't related to finding any particular weapon of mass destruction.",Stephen Harper,war
War is like love it always finds a way.,Bertolt Brecht,war
What they could do with 'round here is a good war. What else can you expect with peace running wild all over the place? You know what the trouble with peace is? No organization.,Bertolt Brecht,war
"War is not merely a political act but a real political instrument, a continuation of political intercourse, a carrying out of the same by other means.",Karl Von Clausewitz,war
My argument is that War makes rattling good history but Peace is poor reading.,Thomas Hardy,war
Our modern states are preparing for war without even knowing the future enemy.,Alfred Adler,war
To all those who walk the path of human cooperation war must appear loathsome and inhuman.,Alfred Adler,war
"I couldn't be happier that President Bush has stood up for having served in the National Guard, because I can finally put an end to all those who questioned my motives for enlisting in the Army Reserve at the height of the Vietnam War.",Larry David,war
I hope my own children never have to fight a war.,George H. W. Bush,war
You can easily die racing to cover a bank robbery as you can in a war zone.,Jessica Savitch,war
"My mom, Irmelin, taught me the value of life. Her own life was saved by my grandmother during World War II.",Leonardo DiCaprio,war
"We experience problem-solving sessions as war zones, we view competing ideas as enemies, and we use problems as weapons to blame and defeat opposition forces. No wonder we can't come up with real lasting solutions!",Margaret J. Wheatley,war
We owe our World War II veterans - and all our veterans - a debt we can never fully repay.,Doc Hastings,war
"For what can war, but endless war, still breed?",John Milton,war
A boy doesn't have to go to war to be a hero he can say he doesn't like pie when he sees there isn't enough to go around.,E. W. Howe,war
"Yes, we love peace, but we are not willing to take wounds for it, as we are for war.",John Andrew Holmes,war
Being over seventy is like being engaged in a war. All our friends are going or gone and we survive amongst the dead and the dying as on a battlefield.,St. Jerome,war
"No one ever said that fighting the war against terrorism and defending our homeland would be easy. So let's support our troops, law enforcement workers, and our mission to keep our nation and our children safe in the days and years to come.",Judy Biggert,war
War has become a luxury that only small nations can afford.,Hannah Arendt,war
Accurst be he that first invented war.,Christopher Marlowe,war
War is the continuation of politics by other means.,Karl Von Clausewitz,war
"Yes quaint and curious war is! You shoot a fellow down you'd treat if met where any bar is, or help to half-a-crown.",Thomas Hardy,war
War alone brings up to their highest tension all human energies and imposes the stamp of nobility upon the peoples who have the courage to make it.,Benito Mussolini,war
"All the business of war, and indeed all the business of life, is to endeavour to find out what you don't know by what you do that's what I called 'guess what was at the other side of the hill'.",Duke of Wellington,war
"What Churchill described as the twin marauders of war and tyranny have been almost entirely banished from our continent. Today, hundreds of millions dwell in freedom, from the Baltic to the Adriatic, from the Western Approaches to the Aegean.",David Cameron,war
"The world will never have lasting peace so long as men reserve for war the finest human qualities. Peace, no less than war, requires idealism and self-sacrifice and a righteous and dynamic faith.",John Foster Dulles,war
There is nothing so subject to the inconstancy of fortune as war.,Miguel de Cervantes,war
"Love and war are the same thing, and stratagems and policy are as allowable in the one as in the other.",Miguel de Cervantes,war
War makes strange giant creatures out of us little routine men who inhabit the earth.,Ernie Pyle,war
War is what happens when language fails.,Margaret Atwood,war
"They are patriotic in time of war because it is to their interest to be so, but in time of peace they follow power and the dollar wherever they may lead.",Henry A. Wallace,war
"The United States established itself as a trustworthy new nation in its first two decades after the Revolutionary War by paying its debts, even when many in the country believed it had no obligation to do so. Alexander Hamilton, the founder of this newspaper, insisted on it.",John Podhoretz,war
"The idea that the rest of the world was somehow being held hostage by the Arab-Israeli conflict once had a minimal basis in reality. In the first 20 years of Israel's existence, every Arab country was in an active state of war with the Jewish state.",John Podhoretz,war
"Hurtling the Pentagon into an unprecedented budgetary meltdown is horrifically irresponsible. Obama doesn't care. This is war - not against the Taliban, but war against the GOP. He has Republicans on the ropes, and that's a victory he savors and desires - unlike Afghanistan, where he seems only to want to turn tail.",John Podhoretz,war
"And I'm a slow writer: five, six hundred words is a good day. That's the reason it took me 20 years to write those million and a half words of the Civil War.",Shelby Foote,war
War is just a racket... I believe in adequate defense at the coastline and nothing else.,Smedley Butler,war
"I beg Osama to stop warring. He is a Muslim, and Islam means peace. Nobody wins in a war... I wish I were tapped in the problem about Iraq. I knew Saddam enough that I could have talked him into surrendering. But it's too late.",Imelda Marcos,war
My father was in the First World War.,Doris Lessing,war
"When there's a war, people get married.",Doris Lessing,war
I wanted to write about my mother as she should have been if she had not been messed up by World War I.,Doris Lessing,war
"You cannot avoid war in life, you cannot avoid the fear of terrorism, you cannot avoid those things now, they are a part of everyday demeanor.",John Mayer,war
Fantasy is toxic: the private cruelty and the world war both have their start in the heated brain.,Elizabeth Bowen,war
"Weapons are an important factor in war, but not the decisive one it is man and not materials that counts.",Mao Zedong,war
Politics is war without bloodshed while war is politics with bloodshed.,Mao Zedong,war
Republicans have been losing the war of words for years now. Now they are just caving because they don't even want to try. I don't agree with that approach.,Herman Cain,war
The real trouble with war (modern war) is that it gives no one a chance to kill the right people.,Ezra Pound,war
Peace is produced by war.,Pierre Corneille,war
"We have a war dictator who was not elected, he snuck in. so he punishes people that threaten him in any way, or even say something he doesn't like. It has no resemblance to democracy.",Joni Mitchell,war
"And we love to dance, especially that new one called the Civil War Twist. The Northern part of you stands still while the Southern part tries to secede.",Dick Gregory,war
All war represents a failure of diplomacy.,Tony Benn,war
Black people have always been used as a buffer in this country between powers to prevent class war.,Toni Morrison,war
"Fascism is a worldwide disease. Its greatest threat to the United States will come after the war, either via Latin America or within the United States itself.",Henry A. Wallace,war
"Business is war. I go out there, I want to kill the competitors. I want to make their lives miserable. I want to steal their market share. I want them to fear me and I want everyone on my team thinking we're going to win.",Kevin O'Leary,war
I would not plan to base my campaign primarily on opposition to the war in the Persian Gulf.,George McGovern,war
"The truth is that I oppose the Iraq war, just as I opposed the Vietnam War, because these two conflicts have weakened the U.S. and diminished our standing in the world and our national security.",George McGovern,war
"When I was a youngster growing up in South Dakota, we never referred to the national debt, it was always referred to as the war debt because it stemmed from World War I.",George McGovern,war
"When you try to find funding for a VVA function, it doesn't seem like it's any trouble at all. People come out of the woodwork with their money to help out because we went over and fought a war.",R. Lee Ermey,war
"It is exactly because we are a city that embraces freedom, that welcomes everyone and encourages their dreams, that New York remains on the front lines in the war on terror.",Michael Bloomberg,war
"Ironically, it is exactly because we are a city that embraces freedom, that welcomes everyone and encourages their dreams, that New York remains on the front lines in the war on terror.",Michael Bloomberg,war
My mother had a son from previous marriage and her husband died in Second World War.,Mikhail Baryshnikov,war
I cannot think of any circumstances in which a government can go to war without the support of parliament.,Tony Blair,war
Accursed be he that first invented war.,Christopher Marlowe,war
An empire founded by war has to maintain itself by war.,Charles de Montesquieu,war
Become an internationalist and learn to respect all life. Make war on machines. And in particular the sterile machines of corporate death and the robots that guard them.,Abbie Hoffman,war
"Say what you want to say about the rest of his presidency, including his tone-deaf response to Katrina and a war waged in Iraq on false pretenses, Bush connected with Americans in the aftermath of 9/11 because he looked as frail and unforgiving as we felt.",Ron Fournier,war
"Don't kid yourself. President Obama's decision to withdraw 33,000 troops from Afghanistan before he stands for reelection is not driven by the United States' 'position of strength' in the war zone as much as it is by grim economic and political realities at home.",Ron Fournier,war
"I am an opponent of Saddam Hussein, but an opponent also, of the sanctions that have killed a million Iraqi children and an opponent of the United States' apparent desire to plunge the Middle East into a new and devastating war.",George Galloway,war
"Many intelligence reports in war are contradictory even more are false, and most are uncertain.",Karl Von Clausewitz,war
Politics is the womb in which war develops.,Karl Von Clausewitz,war
Everything in war is very simple. But the simplest thing is difficult.,Karl Von Clausewitz,war
"Bad things do happen in the world, like war, natural disasters, disease. But out of those situations always arise stories of ordinary people doing extraordinary things.",Daryn Kagan,war
One certain effect of war is to diminish freedom of expression.,Howard Zinn,war
War itself is the enemy of the human race.,Howard Zinn,war
"Monarchs ought to put to death the authors and instigators of war, as their sworn enemies and as dangers to their states.",Elizabeth I,war
"Only the person who has experienced light and darkness, war and peace, rise and fall, only that person has truly experienced life.",Stefan Zweig,war
"Well, I think everybody is frustrated by the finances of the U.N. and the inability to solve problems of war and peace.",George H. W. Bush,war
A bad peace is even worse than war.,Tacitus,war
I didn't know a time when there wasn't a war because I spent all my time from the age of two or three to eight in a coal cellar really.,David Bailey,war
"The White House isn't the place to learn how to deal with international crisis, the balance of power, war and peace, and the economic future of the next generation.",Joe Biden,war
"It is hard, I submit, to loathe bloodshed, including war, more than I do, but it is still harder to exceed my loathing of the very nature of totalitarian states in which massacre is only an administrative detail.",Vladimir Nabokov,war
"Those who remember Washington's cold war culture in the 1980s will recall the shocked reactions to Reagan's intervention. People interested in foreign policy were astonished when in 1985 he met alone at Geneva - alone, not a single strategic thinker at his elbow! - with the Soviet Communist master Gorbachev.",Russell Baker,war
"Vice stirs up war, virtue fights.",Luc de Clapiers,war
"I've been to war, and it's not easy to kill. It's bloody and messy and totally horrifying, and the consequences are serious.",Oliver Stone,war
"Just after World War II, this country led the world in science by every way you could measure it, yet the number of scientists was a tiny proportion of what it is now.",James Lovelock,war
"As you may recall, Truman was extremely unpopular when he finally left Washington in 1953, thanks largely to the Korean War. Today, however, he is thought to have been a solidly good president, a 'Near Great' even, in the terminology of those surveys of historians they do every now and then.",Thomas Frank,war
"Making peace, I have found, is much harder than making war.",Gerry Adams,war
"Al Jazeera aired a new tape of Osama bin Laden. It was the usual stuff, he called Bush evil, the Great Satan, called him a war monger. Basically, the same thing you heard at last night's Democratic debate.",Jay Leno,war
"These days, our senses are bombarded with aggression. We are constantly confronted with global images of unending, escalating war and violence.",Margaret J. Wheatley,war
"You might hold an ethical position that it's wrong to lie, but if you have plans for a war in Iraq, and you want to keep them secret for practical reasons - to reduce casualties, perhaps - and someone asks you about those plans, you may need to lie for a 'good' outcome.",Peter Singer,war
Every day it becomes clearer that this was the wrong war at the wrong time.,Howard Dean,war
"But does that mean that war and violence are inevitable? I would argue not because we have also evolved this amazingly sophisticated intellect, and we are capable of controlling our innate behavior a lot of the time.",Jane Goodall,war
The battle for the mind of Ronald Reagan was like the trench warfare of World War I: never have so many fought so hard for such barren terrain.,Peggy Noonan,war
"It is the youth who must inherit the tribulation, the sorrow... that are the aftermath of war.",Herbert Hoover,war
We managed to put together a compilation that had some creativity to it. In the meantime I was listening to the free radio stations and I noticed that during their war coverage they were playing these songs born out of the Vietnam War that were all critical of the soldiers.,Joni Mitchell,war
"The most disastrous phenomenon of the current situation is the factor that imperialism is employing for its own ends all the powers of the proletariat, all of its institutions and weapons, which its fighting vanguard has created for its war of liberation.",Clara Zetkin,war
The government's War on Poverty has transformed poverty from a short-term misfortune into a career choice.,Harry Browne,war
"The war in Iraq, clearly has not turned out in the way that was hoped.",William Hague,war
I won't undertake war until I have tried all the arts and means of peace.,Francois Rabelais,war
"We've finally given liberals a war against fundamentalism, and they don't want to fight it. They would except that it would put them on the same side as the United States.",Ann Coulter,war
"If anything, we older people yearn for a peaceful world even more than young people do. We are the ones who lost friends or relatives in some war. We are the ones who have lived a lifetime of seeing and reading about human suffering.",Dennis Prager,war
The next war... may well bury Western civilization forever.,Aleksandr Solzhenitsyn,war
War is over if you want it.,Yoko Ono,war
I'll keep us out of war with Oklahoma!,Kinky Friedman,war
"After Nixon resigned in 1974, he engaged in a very aggressive war with history, attempting to wipe out the Watergate stain and memory. Happily, history won, largely because of Nixon's tapes.",Bob Woodward,war
A state of war is not a blank check... when it comes to the rights of the Nation's citizens.,Sandra Day O'Connor,war
"We've got to keep an eye on the battle that we face - a war on workers. And you see it everywhere. It is the Tea Party. And there's only one way to beat and win that war - the one thing about working people is, we like a good fight.",James P. Hoffa,war
Force and fraud are in war the two cardinal virtues.,Thomas Hobbes,war
"I'm a lad of the '60s. I started a magazine to try and end the Vietnam war, but it was a number of years before I had the profile, the financial resources and the time to do more.",Richard Branson,war
"I was going to be a great woman novelist. Then the war came along and I think it's hard for young people today, don't you, to realize that when World War II happened we were dying to go and help our country.",Julia Child,war
"Resist this war on God, freedom of religion and freedom of speech.",Benjamin Carson,war
"Cursed be he above all others Who's enslaved by love of money. Money takes the place of brothers, Money takes the place of parents, Money brings us war and slaughter.",Anacreon,war
"When I was in the war, I was lucky that I was in a plane and never saw the carnage close-up.",George McGovern,war
People didn't have the political guts to stand up against an American war.,George McGovern,war
"I did frequently refer to my war record in World War II, but not in any flamboyant way.",George McGovern,war
I was the guy who was constantly speaking out against the Vietnam War. I have no regrets about that.,George McGovern,war
It is not patriotic to commit young Americans to war unless our national security clearly requires it.,George McGovern,war
"I thought the Vietnam war was an utter, unmitigated disaster, so it was very hard for me to say anything good about it.",George McGovern,war
"There is a strong tendency in the United States to rally round the flag and their troops, no matter how mistaken the war.",George McGovern,war
"It's a tough thing, to know what to do about a war that deep in your gut you feel is wrong and yet watch your peers going off to fight in that war.",George McGovern,war
"Peace is not the absence of war, but a virtue based on strength of character.",Baruch Spinoza,war
"Part of what I loved - and love - about being around older people is the tangible sense of history they embody. I'm interested in military history, for instance, because both my grandfathers fought in World War II. I'm interested in writing because one of those grandfathers wrote books.",Jon Meacham,war
"Here is a pretty good rule of thumb for Democratic Presidents: if it didn't work for Franklin D. Roosevelt, who won four terms and a World War, it probably won't work for you either.",Jon Meacham,war
World War II ended the Great Depression with one of the great public-private industrial collaborations in the history of man.,Jon Meacham,war
"The fact is that America has been at her most prosperous when government and the private sector have been not at war, but in a wary, if often underplayed, alliance. History is unmistakable on this point.",Jon Meacham,war
"Since there will be no one left to talk peace after the next war, it makes good sense to break with tradition and hold the peace conference first.",William Glasser,war
"If we have an honest discussion on whether the war on poverty should be fought with welfare or with economic growth in the private sector, Democrats will lose black votes.",Alveda King,war
"In April 1991, after the Gulf war, Iraq was given 15 days to provide a full and final declaration of all its WMD.",Tony Blair,war
"The threat today is not that of the 1930s. It's not big powers going to war with each other. The ravages which fundamentalist political ideology inflicted on the 20th century are memories. The Cold war is over. Europe is at peace, if not always diplomatically.",Tony Blair,war
"Killing Japanese didn't bother me very much at that time... I suppose if I had lost the war, I would have been tried as a war criminal.",Curtis LeMay,war
"With acting, you wanna see if you can get into trouble without knowing how you're gonna get out of it. It's like the exact opposite of war, where you need an exit strategy. When you're acting, you should get all the way into trouble with no exit strategy, and have the cameras rolling.",John Cusack,war
"I remember the '80s being about the Cold War and Reagan and the homeless problem and AIDS. To me, it was kind of a dark, depressing time.",John Cusack,war
Sports is like a war without the killing.,Ted Turner,war
"As a soldier, I survived World War I when most of my comrades did not.",Lester B. Pearson,war
"The things that inform student culture are created and controlled by the unseen culture, the sociological aspects of our climbing culture, our 'me' generation, our yuppie culture, our SUVs, or, you know, shopping culture, our war culture.",Gus Van Sant,war
"The thing about Hemingway that people forget is that all the stuff he did was at a time where people weren't traveling that much. At 19 he travels to Italy. He goes to the Spanish Civil War. He goes to China, he goes to Africa so at that time to travel that much is really incredible.",Clive Owen,war
"9/11 was a deliberate, carefully planned evil act of the long-waged war on the West by Koran-inspired soldiers of Allah around the world. They hated us before George W. Bush was in office. They hated us before Israel existed. And the avengers of the religion of perpetual outrage will keep hating us.",Michelle Malkin,war
"Henry Kissinger is the greatest living war criminal in the world today, with the blood of millions of people in Vietnam and Cambodia and Laos and Chile and East Timor on his hands. He will never appear in a court or be behind bars.",George Galloway,war
War is the province of danger.,Karl Von Clausewitz,war
"War is not an independent phenomenon, but the continuation of politics by different means.",Karl Von Clausewitz,war
War is regarded as nothing but the continuation of state policy with other means.,Karl Von Clausewitz,war
"America's veterans and troops serving abroad today fought hard to preserve our red, white and blue, from the Revolutionary War to today's Global War Against Terrorism, and Congress' action today is appropriate for one of our most sacred symbols.",Bill Shuster,war
I can't go to war with paparazzi.,Daniel Craig,war
I would have voted 'no' on the Iraq war and 'yes' to Afghanistan.,Rand Paul,war
"American credibility in the war on terrorism depends on a strong stand against all terrorist acts, whether committed by foe or friend.",Arlen Specter,war
"If we had pursued what President Nixon declared in 1970 as the war on cancer, we would have cured many strains. I think Jack Kemp would be alive today. And that research has saved or prolonged many lives, including mine.",Arlen Specter,war
